original	polished	Count
prändätty Henrich Christoph Merckelildä, Cuning. Maij:tin kirjain pränttäjä	henrich christoph merckelildä cuning maijtin kirjain pränttäjä	   1
prändätty Johan Winterildä cun. kirjan pränt.	johan winterildä cun kirjan	   1
hos Anders Zetterberg	anders zetterberg	   1
Th. J. Schreiber	th schreiber	   1
tryckt uti Kongl. finska bok-tryckeriet	finska bok-tryckeriet	   1
tryckt hos Wennberg och Nordström, år	wennberg nordström ar	   1
Wennberg & compagnie	wennberg compagnie	   1
Tryckt hos direct. L. Salvius	l salvius	   1
[Königl. Druckerei]	druckerei	   1
tryckt uti Joh. Georg Langes boktryckeri	joh georg langes	   1
tryckt hos Lorents Ludvig Grefing	lorents ludvig grefing	   1
tryckt uti kongl. finska boktryckeriet, hos Johan Arvid Carlbohm	finska johan arvid carlbohm	   1
tryckt i kongl. finska boktryckeriet, hos Joh. A. Carlbohm	finska joh carlbohm	   1
Wankifs enckia	enckia	   1
Kumblinska tryckeriet	kumblinska	   1
Königl. Buchdruckerei	buchdruckerei	   1
A. J. Nordstöm	nordstöm	   1
J. L. Horrn	l horrn	   1
tryckt uti Kongl. tryckeriet, hos Pet. Momma	pet momma	   1
prändätty, directeurildä ja cuningaliselda kirjan präntäjäldä Jacob Merckellildä	directeurildä cuningaliselda kirjan präntäjäldä jacob merckellildä	   1
[prändätty Cuning:sesa suomalaisesa prändisä]	cuningsesa suomalaisesa prändisä	   1
prändätty directeurildä ja cuningalliselda kirjan-präntäjäldä suuresa-ruhtinan-maasa Suuomesa, Jacob Merckellildä	directeurildä cuningalliselda kirjan-präntäjäldä suuresa-ruhtinan-maasa suuomesa jacob merckellildä	   1
tryckt i det Kongl. tryckeriet, hos directeuren Pet. Momma	det directeuren pet momma	   1
prändätty directeurildä ja cuning. kirjan-präntäjäldä, Jacob Merckellildä	directeurildä cuning kirjan-präntäjäldä jacob merckellildä	   1
prändätty, directeurildä ja cuning:da kirjan-präntäjäldä, Jacob Merckellildä	directeurildä cuningda kirjan-präntäjäldä jacob merckellildä	   1
tryckt uti kongl. tryckeriet, hos directeuren Pet. Momma = Stockholmisa : prändätty cuningallises tryckerisä directeur. Pet. Momman tykönä	directeuren pet momma = stockholmisa cuningallises tryckerisä directeur pet momman tykönä	   1
prändätty directeurildä ja cuning:da nijn myös Turun academian kirjan präntäjäldä Jacob Merckellildä	directeurildä cuningda nijn myös turun academian kirjan präntäjäldä jacob merckellildä	   1
prändätty directeurildä ja cuning:selda kirjan präntäjäldä Jacob Merckellildä	directeurildä cuningselda kirjan präntäjäldä jacob merckellildä	   1
prändätty directeurildä ja cuning:da kirjan-präntäjäldä suuresa-ruhtinan maasa Suomesa, Jacob Merckellildä	directeurildä cuningda kirjan-präntäjäldä suuresa-ruhtinan maasa suomesa jacob merckellildä	   1
prändätty directeurildä ja cuning:da kirjan-präntäjäldä suuresa ruhtinan-maasa Suomesa, Jacob Merckellildä	directeurildä cuningda kirjan-präntäjäldä suuresa ruhtinan-maasa suomesa jacob merckellildä	   1
[prändätty Cuning:sesa suomalaisesa präntisä]	cuningsesa suomalaisesa präntisä	   1
prändätty Kunningallisesa [!] suomalaisesa prändisä	kunningallisesa suomalaisesa prändisä	   1
prändätty directeuri Jacob Merckelli-wainajan prändisä	directeuri jacob merckelli-wainajan prändisä	   1
prändätty directeurildä ja cuning:da, nijn myös Turun academian kirjan-präntäjäldä Jacob Merckellildä	directeurildä cuningda nijn myös turun academian kirjan-präntäjäldä jacob merckellildä	   1
prändätty directeurildä ja cuning:lda, nijn myös Tutun academian kirjan-präntäjäldä Jacob Merckellildä	directeurildä cuninglda nijn myös tutun academian kirjan-präntäjäldä jacob merckellildä	   1
prändätty directeurildä ja cuning:da präntäjäldä Jacob Merckellildä	directeurildä cuningda präntäjäldä jacob merckellildä	   1
prändätty, directeurildä ja cuning:selda kirjan präntäjäldä Jacob Merckellildä	directeurildä cuningselda kirjan präntäjäldä jacob merckellildä	   1
prändätty, directeurildä ja cuning:selda kirjan-präntäjäldä, Jacob Merckellildä	directeurildä cuningselda kirjan-präntäjäldä jacob merckellildä	   1
prändätty, directeurildä ja cuningselda [sic] kirjan-präntäjäldä, Jacob Merckellildä	directeurildä cuningselda kirjan-präntäjäldä jacob merckellildä	   1
prändätty directeurildä ja cuning:selda kirjan-präntäjäldä suuren-ruhtinan-maasa Suomesa, Jacob Merckellildä	directeurildä cuningselda kirjan-präntäjäldä suuren-ruhtinan-maasa suomesa jacob merckellildä	   1
prändätty,directeurilda ja cuning:selda kirjan-präntäjäldä suuren-ruhtinan-maasa Suomesa, Jacob Merckellildä	prändättydirecteurilda cuningselda kirjan-präntäjäldä suuren-ruhtinan-maasa suomesa jacob merckellildä	   1
prändätty directeurildä ja cuningalliselda kirjan-präntäjäldä suuren-ruhtinan-maasa Suomesa, Jacob Merckellildä	directeurildä cuningalliselda kirjan-präntäjäldä suuren-ruhtinan-maasa suomesa jacob merckellildä	   1
prändätty directeurildä ja cuningalliselda kirjan- präntäjäldä suuren ruhtinanmaasa Suomesa, Jacob Merckellildä	directeurildä cuningalliselda kirjan- präntäjäldä suuren ruhtinanmaasa suomesa jacob merckellildä	   1
prändätty directeurildä ja cuningalliselda kirjan-präntäjäldä Jacob Merckellildä	directeurildä cuningalliselda kirjan-präntäjäldä jacob merckellildä	   1
prändätty directeurildä ja cuningalliselda kirjan-präntäjäldä suuren ruhtinanmaasa Suomesa, Jacob Merckellildä	directeurildä cuningalliselda kirjan-präntäjäldä suuren ruhtinanmaasa suomesa jacob merckellildä	   1
prändätty, directeurildä ja cuning:selda kirjan präntäjäldä, Jacob Merckellildä	directeurildä cuningselda kirjan präntäjäldä jacob merckellildä	   1
prändätty directeurildä ja cuning:selda kirjan präntäjäldä suuresa ruhtinan-maasa Suomesa, Jacob Merckelildä	directeurildä cuningselda kirjan präntäjäldä suuresa ruhtinan-maasa suomesa jacob merckelildä	   1
prändätty directeurildä ja cuningall. kirjan-präntäjäldä, Jacob Merckellildä	directeurildä cuningall kirjan-präntäjäldä jacob merckellildä	   1
prändätty directeurildä ja cuningalliselda kirjan präntäjäldä, Jacob Merckellildä	directeurildä cuningalliselda kirjan präntäjäldä jacob merckellildä	   1
prändätty Kuningalisesa Suomen kirjan prändisä, Johan Arvid Carlbohmin tykönä	kuningalisesa suomen kirjan prändisä johan arvid carlbohmin tykönä	   1
Merckell, Jacob	merckell jacob	   1
prändätty directeurin ja kuningallisen kirjan-pränttäjän suren ruhtinan maasa Suomesa Jacob Merckellin tykönä	directeurin kuningallisen kirjan-pränttäjän suren ruhtinan maasa suomesa jacob merckellin tykönä	   1
[präntätty, directeuril ja cuningalliselda kirjan präntäjäldä, Jacob Merckellildä]	directeuril cuningalliselda kirjan präntäjäldä jacob merckellildä	   1
excud. H. C. Merckell, Reg. typogr.	h c merckell reg	   1
typis Iohannis Iacobi Adleri, seren. ducis Aul. et Acad. typographi	iohannis iacobi adleri seren ducis aul typographi	   1
[Schwiegerau]	schwiegerau	   1
apud Jacobum Douzy	jacobum douzy	   1
litteris Tennemannianis	tennemannianis	   1
litteris Mavkianis	mavkianis	   1
in officina Barmeieriana	barmeieriana	   1
typis Ioann. Christ. Dieterich	ioann christ dieterich	   1
typis I. H. Eckhardt, Reg. Acad. typogr.	h eckhardt reg	   1
literis Hier. J. Struckii, Reg. Acad. typogr.	literis hier struckii reg	   1
litteris Danielis Benjaminis Starckii, Reg. Adac. typogr.	danielis benjaminis starckii reg adac	   1
excudit Johannes Brendeken, Regiae Academiae typographus	johannes brendeken academiae typographus	   1
typis Joh. Ernesti Kallmeyeri	joh ernesti kallmeyeri	   1
litteris Joh. Fred. Edman, Reg. Acad. typogr.	joh fred edman reg	   1
litteris viduae director. Johann. Edman	director johann edman	   1
ex praelo viduae direct. Johan. Edman	praelo johan edman	   1
impress. lit. direct. Johann. Edman	lit johann edman	   1
apud Joh. Edman, direct. et. Reg. Acad. typogr.	joh edman reg	   1
apvd Iohan Edman, director. et Reg. Acad. typogr.	apvd iohan edman director reg	   1
apud Joha. Edman, director. et Reg. Acad. typogr.	joha edman director reg	   1
tryckt hos direct. Johan Edman, Kongl. Acad. boktr.	johan edman	   1
apud Joh. Edman	joh edman	   1
litteris Edmannianis	edmannianis	   1
impress. a Laur. Arv. Collin	laur arv collin	   1
excud. L. M. Höjer, Reg. Acad. typog.	l m höjer reg	   1
typis direct. Laurentii Salvii	laurentii salvii	   1
exc. L. M. Höjer, Reg. Acad. typ.	l m höjer reg typ	   1
exc. L. M. Höjer, Reg. Acad. typogr.	l m höjer reg	   1
typis Laurentii Ludov. Grefingii	laurentii ludov grefingii	   1
in Typogr. Reg.	reg	   1
[Höjer]	höjer	   1
[Johan Höjers encka?]	johan höjers encka	   1
typis Laur. M. Höjer, Reg. Acad. typogr.	laur m höjer reg	   1
typis Pet. Georg. Nyström	pet georg nyström	   1
typis viduae b. Höjeri	b höjeri	   1
apud vid. b. Joh. Höjeri	vid b joh höjeri	   1
apud viduam b. Joh. Höjer	b joh höjer	   1
typis Höjerianis	höjerianis	   1
typis J. H. Werner, S:ae R:ae M:tis & Upsal. Academiae typogr.	h werner sae rae mtis upsal academiae	   1
typis J. H. Werner	h werner	   1
ex officina Werneriana	werneriana	   1
per Joh. H. Werner, s. r. m:tis & Acad. Ups. typogr.	per joh h werner r mtis ups	   1
exc. Laur. M. Höjer, Reg. Acad. typ.	laur m höjer reg typ	   1
tryckt hos Johan Edman, Kongl. Acad. boktr.	johan edman	   1
apud Joh. Edman. direct. & Reg. Acad. typogr.	joh edman reg	   1
apud Joh. Edman Reg. Acad. typograph.	joh edman reg typograph	   1
excud. L. M. Höjer, Reg. Acad. typ.	l m höjer reg typ	   1
typis Johannis Wepplingii, seren. principis & Univers. typographi	johannis wepplingii seren principis univers typographi	   1
typis Johannis Wepplingi, seren. princ. & Acad. typogr.	johannis wepplingi seren princ	   1
typis Joh. Wepplingi, seren. princ. & Acad. typogr.	joh wepplingi seren princ	   1
typis Nicolais Schwwiegerovii, ampliss. senat. typogr.	nicolais schwwiegerovii ampliss senat	   1
typis Io. Iac. Adleri, seren. princ. & Acad. typogr.	iac adleri seren princ	   1
typis Johannis Wepplingi, serenissimi principis & Acad. typogr.	johannis wepplingi serenissimi principis	   1
typis Nicolai Schwiegerovii, ampl. senat. typographi	nicolai schwiegerovii ampl senat typographi	   1
typis, Io. Iac. Adlerii, ser. princ. & Acad. typogr.	iac adlerii ser princ	   1
[Ewald Ziervogel]	ewald ziervogel	   1
trykt hos J. F. Morthorstes enke	f morthorstes enke	   1
[typis Edmannianis]	edmannianis	   1
tryckt hos J. H. Eckhardt, Kongl. acad. boktryckare	h eckhardt	   1
tryckte hos Carl Stolpe	carl stolpe	   1
tryckt hos Kongl. boktr. J. C. Frenckells enka	c frenckells	   1
tryckt hos Joh. P. Hammarin	joh p hammarin	   1
[J. C. Frenckell, leski]	c frenckell leski	   1
tryckt af Lars A. Collin	lars collin	   1
litteris direct. Johan. Edman, Reg. Acad. typographi	johan edman reg typographi	   1
tryckt hos directeuren Johan Edman, Kongl. acad. boktr.	directeuren johan edman	   1
Tryckt. Hos. K. Acad. Boktr. J. C. Frenckells. Enka	k c frenckells	   1
tryckt hos Kongl. Acad. boktryckaren Joh. C. Frenckells enka	joh c frenckells	   1
tryckt i Langiska boktryckeriet	langiska	   1
tryckt hos Anders Jacobs. Nordström	anders jacobs nordström	   1
Kongl. acad. boktr. Frenckells enka	frenckells	   1
Tryckt. hos. [sic] Kongl. Acad. Boktr. J. C. Frenckells. Enka	c frenckells	   1
prändätty Kuning:sen Acad. kirjan-präntäjän J. C. Frenckellin lesken tykönä	kuningsen kirjan-präntäjän c frenckellin lesken tykönä	   1
[J. C. Frenckellin leski]	c frenckellin leski	   1
tryckt. Hos. Joh. Christoph. Frenckell	joh christoph frenckell	   1
tryckt. Hos. Johan. Christopher. Frenckell	johan christopher frenckell	   1
tryckt hos Joh. Christoph. Frenckell, Kgl. adac. boktr.	joh christoph frenckell kgl adac	   1
tryckt hos Joh. Christoph. Frenckell, Kongl. acad. boktr.	joh christoph frenckell	   1
tryckt hos Kongl. acad. bokt. J. C. Frenckell	bokt c frenckell	   1
[de l'imprimerie de Jean Christophe Frenckell, imprimeur de L'Academie d'Abo]	de de jean christophe frenckell imprimeur de d'abo	   1
tryckt hos afledne Kongl. Acad. boktryckaren Johan Christoffer Frenckells enka	afledne johan christoffer frenckells	   1
tryckt hos Kgl. acad. boktr. J. C. Frenckells enka	kgl c frenckells	   1
tryckt hos Johan Lindh	johan lindh	   1
tryckt af Georg Wilh. Londicer, Kongl. pr. boktryckare	georg wilh londicer pr	   1
tryckt hos Kgl. acad. boktr. Joh. Christoph. Frenckell	kgl joh christoph frenckell	   1
prändätty Kuning:sen acad. kirj. pränttäj. Johan Christoph. Frenckellildä	kuningsen kirj pränttäj johan christoph frenckellildä	   1
typis Georgii Wilhelmi Londicer	georgii wilhelmi londicer	   1
tryckt hos J. C. Frenckell, Kgl. ac. boktr.	c frenckell kgl	   1
prändätty Kuning:sen Acad. kirjan präntt. J. C. Frenckellildä	kuningsen kirjan präntt c frenckellildä	   1
prändätty Kuningallisen acad. kirjan präntt. J. C. Frenckellildä	kuningallisen kirjan präntt c frenckellildä	   1
tryck [sic] hos Carl Stolpe	carl stolpe	   1
trykt hos Johan Christopher Frenckell	johan christopher frenckell	   1
tryckt i framl. direct. Lars Salvii tryckeri	framl lars salvii tryckeri	   1
[...]istopher Frenckell	istopher frenckell	   1
tryckt hos Johan Edman, Kongl. acad. boktryckare	johan edman	   1
Tryckt. Hos. Direct. Lars. Salvius.	lars salvius	   1
tryckt hos Johan Christo[...] Frenckell	johan christo frenckell	   1
Tryckt. Hos. Joh. Christoph. Frenckell	joh christoph frenckell	   1
tryckt Joh. Christ. Frenckell	joh christ frenckell	   1
Tryckt. Hos. Joh. Christoph. Frenckell.	joh christoph frenckell	   1
tryckt i Kongl. Finska Boktryckeriet, hos Joh. Arvid Carlbohm	finska joh arvid carlbohm	   1
i Kongl. academiae boktryckeriet	academiae	   1
tryckt. Hos. J. C. Frenckell	c frenckell	   1
tryckt i Kongl. academiae boktryckeriet	academiae	   1
tryckt i dess officin	dess	   1
Tryckt. Hos. Johan. Christopher. Frenckell	johan christopher frenckell	   1
Tryckt. Hos. Johan. Christoph. Frenckell.	johan christoph frenckell	   1
tryct [sic] hos Carl Stolpe	carl stolpe	   1
tryckt af Joh. C. Frenckell	joh c frenckell	   1
prändätty Joh. Christoph. Frenckell	joh christoph frenckell	   1
tryckt uti Konglige amiralitets boktryckeriet	konglige	   1
Tryckte. Hos. Johan. Christopher. Frenckell.	johan christopher frenckell	   1
prändätty Kuningall. academian alla olewasa präntisä	kuningall academian alla olewasa präntisä	   1
[typis Joh. Christoph. Frenckell]	joh christoph frenckell	   1
prändätty [...] Fre[...]	fre	   1
impressum â Johanne Christophoro Frenckell	johanne christophoro frenckell	   1
Tryckt. Hos. Johan. Christopher. Frenckell.	johan christopher frenckell	   1
Johan Christopher Frenckell[...]	johan christopher frenckell	   1
typis. Direct. Laurentii. Salvii.	laurentii salvii	   1
[Tryckt. Hos. Johan. Christopher. Frenckell]	johan christopher frenckell	   1
gedruckt bey Johan Edman	johan edman	   1
tryckt hos Joh. Edman	joh edman	   1
[tryckt hos directeuren och kongl. boktryckaren i storförstendömet Finland, Jacob Merckell]	directeuren i storförstendömet finland jacob merckell	   1
tryckt hos direct. och kongl. boktr. i storförstendömet Finland, Jacob Merckell	i storförstendömet finland jacob merckell	   1
tryckt hos direct. och kongl. boktr. i storförstedömet Finland, Jacob Merckell	i storförstedömet finland jacob merckell	   1
tryckt hos directeuren och kongl. boktryckaren i Stor-förstendömet Finland, Jacob Merckell	directeuren i stor-förstendömet finland jacob merckell	   1
tryckt hos direct. och kongl. boktr. i stor furstendömet Finland, Jacob Merckell	i stor furstendömet finland jacob merckell	   1
tryckt af Johan Kaempe	johan kaempe	   1
tryckt uti Harbergs & Hesselbergs tryckeri	harbergs hesselbergs tryckeri	   1
tryckt hos Harberg och Hesselberg	harberg hesselberg	   1
tryckt hos Harberg & Hesselberg	harberg hesselberg	   1
typis. Direct. Laur. Salvii.	laur salvii	   1
prändätty directeurildä ja cuning. kirjanpräntäjäldä suuresa ruhtinan-maasa Suomesa, Jacob Merckellildä	directeurildä cuning kirjanpräntäjäldä suuresa ruhtinan-maasa suomesa jacob merckellildä	   1
prändätty direct. ja cuningallisen kirjan pränttäjäldä suuren ruht. maasa Suomesa, Jacob Merckellildä	cuningallisen kirjan pränttäjäldä suuren ruht maasa suomesa jacob merckellildä	   1
prändätty directeurildä ja cuningalliselda kirjan-präntäjäldä suuren ruhtinanmaas Suomes, Jac. Merckellildä	directeurildä cuningalliselda kirjan-präntäjäldä suuren ruhtinanmaas suomes jac merckellildä	   1
prändätty directeur. ja cuningallisen kirjan-präntäjäldä, Jacob Merckellildä	directeur cuningallisen kirjan-präntäjäldä jacob merckellildä	   1
tryckt hos direct. och kongl. boktr. i storförstend. Finland Jacob Merckell	i storförstend finland jacob merckell	   1
tryckt hos L. M. Höjer, Kongl. acad. boktr.	l m höjer	   1
impressit direct. & typogr. reg. mag. duc. Finland, Jacob Merckell	reg mag duc finland jacob merckell	   1
tryckt hos directeuren och Kongl. bokt. i stor-förstendömet Finland, Jacob Merckell	directeuren bokt i stor-förstendömet finland jacob merckell	   1
tryckt hos Laur. M. Höjer, Kongl. Acad. boktr.	laur m höjer	   1
tryckt hos Joh. Lindh, kongl. priv. boktr.	joh lindh	   1
prändetty directeurildä ja cuningalliselda kirjanprändäjäldä Jacob Merckellildä	prändetty directeurildä cuningalliselda kirjanprändäjäldä jacob merckellildä	   1
tryckt hos directeuren och kongl. boktr. i stor-förstendömet Finnland, Jacob Merckell	directeuren i stor-förstendömet finnland jacob merckell	   1
tkyckt [sic] hos direct. och kongl. boktr. i stor-förstendömet Finland, Jacob Merckell	tkyckt i stor-förstendömet finland jacob merckell	   1
tryckt hos direct. och kongl. boktr. i stor-furstendömet Finland, Jacob Merckell	i stor-furstendömet finland jacob merckell	   1
tryckt hos direct. ock kongl. boktr. i stor-förstendömet Finnland Jacob Merckell	ock i stor-förstendömet finnland jacob merckell	   1
tryckt hos directeuren och kongl. boktr. i storförstendömet Finnland, Jacob Merckell	directeuren i storförstendömet finnland jacob merckell	   1
tryckt hos direct. Herman Arn. Moeller, Kongl. gymn. privileg. boktryckare	herman arn moeller privileg	   1
tryckt af Petter Jöransson Nyström	petter jöransson nyström	   1
[L. M. Höjer]	l m höjer	   1
tryckt af Peter Jör. Nyström	peter jör nyström	   1
prändätty directeurildä, ja Cuning. acad. kirjan-präntäjäldä, Jacob Merckellildä	directeurildä cuning kirjan-präntäjäldä jacob merckellildä	   1
tryckt hos directeur., Kongl. acad. och stadsens boktr. i stor-förstendömet Finnland, Jacob Merckell	directeur stadsens i stor-förstendömet finnland jacob merckell	   1
tryckt af Joh. Kämpe, Kongl. academ. boktr.	joh kämpe academ	   1
prändätty Joh. Kämpildä, Cuningallisen acad. kirjanpräntäjäldä	joh kämpildä cuningallisen kirjanpräntäjäldä	   1
tryckt. af. Peter. Jöransson. Nyström	peter jöransson nyström	   1
tryckt hos kongl. boktr. i stor-förstend. Finland, sal. Henrich Christother [sic] Merckels enka	i stor-förstend finland sal henrich christother merckels	   1
trykt af Joh. Kiämpe, Kongl. acad. boktr.	joh kiämpe	   1
prändätty Joh. Kämpildä, Kunung. [sic] acad. kirjänpr. [sic]	joh kämpildä kunung kirjänpr	   1
gedrukt by de Erfgen: van Iz: van Hulkenroy, in de Lange Begynestraat, in de Konings hulk	de erfgen van iz van hulkenroy de lange begynestraat de konings hulk	   1
gedruckt, by M. van Hulkenroy, aan de Markt	m van hulkenroy aan de markt	   1
tryckt, af Joh. Kämpe, Kongl. acad. boktr.	joh kämpe	   1
tryckt af Joh. Kiämpe, Kongl. academ. boktr.	joh kiämpe academ	   1
typis Joh. Kaempe, Reg. Acad. typogr.	joh kaempe reg	   1
tryckt hos kongl. boktr. i stor-förstendömet Finland, sal. Henrich Christopher Merckells änckia	i stor-förstendömet finland sal henrich christopher merckells	   1
tryckt af Joh. Kiämpe, Kongl. acad. bokte [sic]	joh kiämpe bokte	   1
tryckt af Joh. Kaempe, Kongl. acad. boktr.	joh kaempe	   1
trykt af Peter Jör. Nyström	peter jör nyström	   1
[Johan Kämpe?]	johan kämpe	   1
Tryckt. Af. Peter. Jöransson. Nyström	peter jöransson nyström	   1
prändätty Joh. Kiaempildä	joh kiaempildä	   1
trykt, af Joh. Kiämpe, Kongl. acad. boktr.	joh kiämpe	   1
tryckt af Joh Kiaempe, Kongl. acad. boktr.	joh kiaempe	   1
trykt af Joh. Kiämpe Kongl. acad. boktr.	joh kiämpe	   1
[Petter Jöransson Nyström]	petter jöransson nyström	   1
tryckt hos sal. Frantz Philipp Paulssens enkia	sal frantz philipp paulssens enkia	   1
brändaty [sic] Laurentius Salviuxen tykona [sic]	brändaty laurentius salviuxen tykona	   1
tryckt hos sal. Johan Höjers encka	sal johan höjers encka	   1
tryckt, hos Johan Christopher Mercell [sic]	johan christopher mercell	   1
tryckt uti Kongl. antiq. archiv. boktryckeriet, hos sal. Joh. L. Horrns enkia, af Carl Johansson Röpke	antiq archiv sal joh l horrns enkia carl johansson röpke	   1
prändätty Johan Christopher Merckellildä	johan christopher merckellildä	   1
typ: Laurent. Ludovic. Grefing.	typ laurent ludovic grefing	   1
tryckt hos Ludvig Decreaux, directeur öfwer Kongl. academiens priviligerade tryckerij i Lund	ludvig decreaux directeur öfwer academiens priviligerade i lund	   1
tryckt uti thet Kongl. boktryckeriet	thet	   1
gedruckt bey Joh. Kiämpe, Königl. Acad. Buchdr.	joh kiämpe buchdr	   1
tryckt uti det Kongl. boktryckeriet, af. F. Phil. Paulssen	det f phil paulssen	   1
tryckt af Joh. Kiämpe Kongl. acad. boktryckare	joh kiämpe	   1
tryckt af Joh. Kiämpe, Kongl. acd. [sic] boktr.	joh kiämpe acd	   1
tryckt uthi det Kongl. boktryckeriet	det	   1
tryckt hos Iohan Christofer Merckell	iohan christofer merckell	   1
gedruckt bey Iohan Christopher Merckell	iohan christopher merckell	   1
tryckt av Johan Kiämpe, Kongl. acad. boktr.	johan kiämpe	   1
tryckt hos Joh. Laur. Horrn, Kongl. antiqv. archiv. boktr.	joh laur horrn antiqv archiv	   1
tryckt hos Kongl. acad. bokt. sal. Joh. Höjers enckia	bokt sal joh höjers enckia	   1
gedruckt von Joh. Kiämpe, königl. Acad. Buchdr.	von joh kiämpe buchdr	   1
tryckt hos Iohan. Christopher Merckell	iohan christopher merckell	   1
tryckt af Joh Kiämpe, Kongl. acad. boktr.	joh kiämpe	   1
tryckt vthi thet kongl. tryckeriet. Af O. H.	thet h	   1
tryckt, af Joh. Kiämpe, Kongl. acad. boktr.	joh kiämpe	   1
tryckt af Joh; Kiämpe, Kongl. acad. boktr.	joh kiämpe	   1
tryckt af Kongl. Acad. boktr. Joh. Kiämpe	joh kiämpe	   1
typis Petri Georg Nyström	petri georg nyström	   1
tryckt af Johan Kiämpe Konl. [sic] acad. booktr.	johan kiämpe konl	   1
tryckt hos kongl. boktryckarens i stor-förstendömet Finland, sal. Henr. C. Merckells encka	boktryckarens i stor-förstendömet finland sal henr c merckells encka	   1
tryckt af Joh. Kiämpe Kongl. Accad. [sic] boktr.	joh kiämpe accad	   1
tryckt hos Frantz Philipp Paulssen	frantz philipp paulssen	   1
präntätty Joh. Kiämpildä	joh kiämpildä	   1
tryck uti det Kongl. boktryckeriet, af F. Phil. Paulssen	det f phil paulssen	   1
tryckt hos Joh. Laur. Horrn, Kongl. Antiqivit. archiv. boktr.	joh laur horrn antiqivit archiv	   1
tryckt hos kongl. boktryckarens uti stor-förstendömet Finland, sal. Henr. C. Merckells encka	boktryckarens stor-förstendömet finland sal henr c merckells encka	   1
tryckt hos Joh. L. Horrn, Kongl. Antiqv. archiv. boktr.	joh l horrn antiqv archiv	   1
tryckt uthi det Kongl. tryckeriet, af F. Phil. Paulssen	det f phil paulssen	   1
excudeb. Reg. Acad. typogr. Joh. Kiämpe	excudeb reg joh kiämpe	   1
pränta af puk-dryckaren Juhan Gämpä	puk-dryckaren juhan gämpä	   1
tryckt af And. Laureliuo, Kongl. gymn. boktr.	laureliuo	   1
tryckt hos sal. H. C. Merckells änckia	sal h c merckells	   1
tryckt uti det Kongl. boktryckeriet	det	   1
tryckt uti sahl. Henr. C. Merckell boktryckerie	henr c merckell boktryckerie	   1
tryckt uti sahl. H. C. Merckells boktryckerie	h c merckells boktryckerie	   1
tryckt af. Joh. Kiämpe Kongl. acad. boktr.	joh kiämpe	   1
gedruckt bey Georg Christian Schindler, Königl. hochpreissl. Regierungs, und E. hoch-edlen Raths Buchdrucker	georg christian schindler hochpreissl regierungs e hoch-edlen	   1
typis Georgii Christiani Schindleri, illustr. reg. regim. & generos. senat. typogr.	georgii christiani schindleri illustr reg regim generos senat	   1
tryckt hos sal. Andr. Biörkmans enka	sal andr biörkmans	   1
gedruckt bey sel. Andreas Biörckmans nachgel. Wittwe	sel andreas biörckmans nachgel wittwe	   1
tryckt av Joh. Kiämpe Kongl. acad- [sic] boktr.	joh kiämpe acad-	   1
tryckt af Joh- [sic] Kiämpe Kongl. Acad. bokt[...]	joh- kiämpe bokt	   1
imprimebat Israel Falck	israel falck	   1
tryckt af Joh. Kiämpe. Kongl. acad. boktr.	joh kiämpe	   1
tryckt av Joh. Kiämpe Kongl. acad. boktr.	joh kiämpe	   1
tryckt uti sahl. Merckells boktryckerie	merckells boktryckerie	   1
tryckt uti sahl. Merckells boktryckerie, af F. P. Paulssen	merckells boktryckerie f p paulssen	   1
tryckt hos sal. Andr. Biörkmans enckia	sal andr biörkmans enckia	   1
tryckt af Joh- [!] Kiämpe Kongl. Acad. boktr.	joh- kiämpe	   1
tryckt uti salig herr Merckells officin	salig merckells	   1
excud. Joh- [!] Kiämpe Reg. Acad- [!] typogr.	joh- kiämpe reg acad-	   1
tryckt af Joh. Kiaempe Kongl. Acad. boktr.	joh kiaempe	   1
tryckt uti sal. Merckells officin	sal merckells	   1
tryckt uti sal. herr Merckells officin	sal merckells	   1
tryckt af Joh [sic] Kiämpe Kongl. acad. boktr.	joh kiämpe	   1
tryckt hos kongl. booktr. uti stor furstendömet Finland Henr. C. Merckell	stor furstendömet finland henr c merckell	   1
