original	polished	Count
präntetty directörin Joh. A. Carlbohmin tykönä	directörin joh carlbohmin tykönä	   2
pränt. Henr. C. Merckell, cun. kirjan-präntäjä	henr c merckell cun kirjan-präntäjä	   2
prändätty Kunningallisesa suomalaisesa präntisä	kunningallisesa suomalaisesa präntisä	   2
löyty myytäwänä Christian Trappin tygönä Turus, präntätty F. P. Paulssenildä	löyty myytäwänä christian trappin tygönä turus f p paulssenildä	   2
prändätty Kuningallisesa suomalaisesa prändisä, Johan Arv. Carlbohmin omalla kulutuxella	kuningallisesa suomalaisesa prändisä johan arv carlbohmin omalla kulutuxella	   2
prändätty directeur. ja cuningallis. kirjan-präntäjäldä suuren-ruhtinanm. Suomesa, Jacob Merckellildä	directeur cuningallis kirjan-präntäjäldä suuren-ruhtinanm suomesa jacob merckellildä	   2
präntätty Wennbergin tykönä ja compagnie	wennbergin tykönä compagnie	   2
prändätty Kuningallisesa suomalaisesa prändisä, Joh. Arv. Carlbohmin omalla kulutuxella	kuningallisesa suomalaisesa prändisä joh arv carlbohmin omalla kulutuxella	   2
prändetty J. A. Carlbohmilda	prändetty carlbohmilda	   2
C. Trapp culutuxella prändätty Joh. Kiämpildä.	c trapp culutuxella joh kiämpildä	   2
prändätty directeurildä ja cuning:da kirjan pränt. suuren-ruhtinan-maasa Suomesa, Jacob Merckellildä	directeurildä cuningda kirjan suuren-ruhtinan-maasa suomesa jacob merckellildä	   2
tryckt hos Kongl. acad. boktryckaren J. C. Frenckells enka	c frenckells	   2
tryckt hos Joh. C. Frenckell, Kongl. acad. boktr.	joh c frenckell	   2
[tryckt hos Carl Stolpe]	carl stolpe	   2
impr. Joh. Kiämpe, Reg. Acad. typogr.	joh kiämpe reg	   2
tryckt af Joh. Kiaempe, Kongl. ac. boktr.	joh kiaempe	   2
tryckt hos Jo. Wal.	jo wal	   2
excud. Joh. Kiaempe, Acad. typogr.	joh kiaempe	   2
[impress. apud viduam Reg. Acad. typ. J. C. Frenckell]	reg typ c frenckell	   2
excud. Joh. Kiaempe, Reg. acad. typogr.	joh kiaempe reg	   2
impr. apud Jo. Laurentii Wallium, Regiae Univ. ibid. typogr.	jo laurentii wallium univ ibid	   2
impressum apud viduam Reg. Acad. typogr. J. C. Frenckell	reg c frenckell	   2
[apud viduam J. Wall]	wall	   2
impressit direct. & typogr. Reg. magn. duc. Finland. Jacob Merckell	reg magn duc finland jacob merckell	   2
imprimeb. Johan. Kiämpe Reg. Acad. typogr.	imprimeb johan kiämpe reg	   2
exc. Joh. Kiampe, R. Ac. typ.	joh kiampe r typ	   2
typis Johannis Christophori Frenckell, Reg. Acad. typogr.	johannis christophori frenckell reg	   2
ex. J. Wal.	wal	   2
impressit direct. & typogr. reg. mag. duc. Finland. Jacob. Merckell	reg mag duc finland jacob merckell	   2
ex. J. Wall	wall	   2
impressa apud viduam Reg. Acad. typ. J. C. Frenckell.	reg typ c frenckell	   2
impressit Johan. Christophor. Frenckell	johan christophor frenckell	   2
tryckt hos Johan Christopher Frenckell, Kongl. Acad. boktr.	johan christopher frenckell	   2
tryckt, hos direct. och kongl. boktr. i stor-furstendömet Finland, Jacob Merckell	i stor-furstendömet finland jacob merckell	   2
exc. J. Wall	wall	   2
impr. apud Jo. Wall	jo wall	   2
impr. E. Flodström R. A. typ.	e flodström r typ	   2
tryckt hos directeuren och Kongl. boktr. i Stor-förstendömet Finland, Jacob Merckell	directeuren i stor-förstendömet finland jacob merckell	   2
excud. Joh. Kiampe, Reg. Ac. typ.	joh kiampe reg typ	   2
impr. Eric Flodström, Reg. Acad. typogr.	eric flodström reg	   2
impressit direct. & typog. Reg. M. Duc. Finland. Jacob Merckell	reg m duc finland jacob merckell	   2
impressit direct. & typogr. reg. mag. duc. Finland. Jacob Merckell.	reg mag duc finland jacob merckell	   2
exc. Joh. Kaempe, Reg. Acad. typogr.	joh kaempe reg	   2
excud. Joh. Kiaempe, Reg. Acad. typog.	joh kiaempe reg	   2
excud. Joh. Kiaempe	joh kiaempe	   2
Joh. Kiaempe, Reg. Acad. typogr.	joh kiaempe reg	   2
per Joh. Kiaempe, Reg. Acad. typ.	per joh kiaempe reg typ	   2
excud. Joh. Kämpe, Reg. Ac. typ.	joh kämpe reg typ	   2
exc. J. Kiaempe, Reg. Ac. typ.	kiaempe reg typ	   2
excud. Joh. Kiämpe R. Ac. typ.	joh kiämpe r typ	   2
apud viduam Reg. Acad. typogr. J. C. Frenckell	reg c frenckell	   2
impressit direct. & typogr. reg. mag. duc. Finland Jacob Merckell	reg mag duc finland jacob merckell	   2
tryckt hos direct. och kongl. boktryckaren i stor-förstendömet Finland, Jacob Merckell	i stor-förstendömet finland jacob merckell	   2
hos K. Acad. boktr. J. C. Frenckells enka	k c frenckells	   2
impressit direct. & typogr. Reg. Magn. Duc. Finland. Jacob Merckell	reg magn duc finland jacob merckell	   2
impressit Reg. Acad. typog. Joh. C. Frenckell	reg joh c frenckell	   2
exc. Reg. Acad. typ. Joh. Kiaempe	reg typ joh kiaempe	   2
typis Academicis exprimeb. Joh. Kiaempe, R. U. t.	academicis exprimeb joh kiaempe r t	   2
excud. Joh. Kiaempe, R. Ac. typ.	joh kiaempe r typ	   2
impress. Johan. Christoph. Frenckell	johan christoph frenckell	   2
impressit direct. & typogr. reg. magn. duc. Finland, Jacob Merckell	reg magn duc finland jacob merckell	   2
excud. Joh. Kiampe, Reg. Acad. typogr.	joh kiampe reg	   2
impressit Joh. C. Frenckell, R. Ac. typ.	joh c frenckell r typ	   2
impress. in typographia ad Regiam Academiam	regiam academiam	   2
excud. Joh. Kiämpe, R. Acad. typ.	joh kiämpe r typ	   2
typis Johannis Christoph. Frenckell	johannis christoph frenckell	   2
exc. Joh. Kiämpe Reg. Ac. typ.	joh kiämpe reg typ	   2
litteris Frenckellianis	frenckellianis	   2
W. Faden	w faden	   1
tryckt i Bibel-Sällskapets Boktryckeri	bibel-sällskapets	   1
im Verlage des Geograph. Instituts	im verlage geograph instituts	   1
[Broderus Carolus Julius Witting]	broderus carolus julius witting	   1
[Frid. Wilh. Aug. Argelander]	frid wilh aug argelander	   1
[Jacobus Johannes Amnell]	jacobus johannes amnell	   1
[G. Klint]	klint	   1
[Bernhardus Wilhelmus Brunou]	bernhardus wilhelmus brunou	   1
forlagt af L. Veeken, trykt hos T. E. Raugel, og faaes tilkjøbs i Pilestraedet No. 111	forlagt l veeken e raugel og faaes tilkjobs i pilestraedet no	   1
tryckt hos directeuren Joh. A. Carlbohm	directeuren joh carlbohm	   1
litteris J. C. Frenckell & fil.	c frenckell fil	   1
Depôt imperial des cartes	depot cartes	   1
prentijuwum Chr. Ludw. Hjelt	prentijuwum chr ludw hjelt	   1
[Carl Axel Gottlund]	carl axel gottlund	   1
Kongl. landmäteri kontoret	landmäteri kontoret	   1
Elméns och Granbergs tryckeri	elmens granbergs tryckeri	   1
Christ. Frenckell	christ frenckell	   1
Joh. Christ. Frenckell	joh christ frenckell	   1
de l'imprimerie de N. Gretsch	de de n gretsch	   1
in der Vossischen Buchhandlung	vossischen buchhandlung	   1
Elméns och Granbergs Tryckeri	elmens granbergs tryckeri	   1
Marquardska tryckeriet	marquardska	   1
im Verlage des Geograph: Instituts	im verlage geograph instituts	   1
hos Strinnholm och Häggström	strinnholm häggström	   1
imprimé chez Charles Deleen et J. G. Forsgren, MDCCCI	chez charles deleen forsgren mdccci	   1
Verlage des Industrie-Comptoirs	verlage industrie-comptoirs	   1
Gedruckt bey Friedrich Drechsler	friedrich drechsler	   1
tryckt hos Nils Magnus Lindh, 1807. På eget förlag	nils magnus lindh pa eget förlag	   1
de lʼimprimerie de P. P. A. Pluchart, Petite-Morskoї, No 120	de lʼimprimerie de p p pluchart petite-morskoї no	   1
de lʼimprimerie de F. Drechsler	de lʼimprimerie de f drechsler	   1
printed for R. Phillips ... by T. Giilet, Salisbury-square	r phillips giilet salisbury-square	   1
Chez Levrault, Schoell, et Compagnie, libraires, Rue de Seine ...	chez levrault schoell compagnie libraires rue de seine	   1
chez Levrault, Schoell et Comp. libraires, Rue de Seine	chez levrault schoell comp libraires rue de seine	   1
In der Vossischen Buchhandlung	vossischen buchhandlung	   1
Printed for Joseph Mawman ...	joseph mawman	   1
Čertežnaâ Gosudarstvennago Admiraltejskago Departamenta	certeznaa gosudarstvennago admiraltejskago departamenta	   1
Jak. Juteini	jak juteini	   1
[A. Cederwaller]	cederwaller	   1
[And. Cederwaller]	cederwaller	   1
[kokoaja]	kokoaja	   1
Charles Deleen et J. G. Forsgren	charles deleen forsgren	   1
N. Gretsch	n gretsch	   1
präntätty J. C. Frenckellin ja pojan kirjan-präntisä	c frenckellin pojan kirjan-präntisä	   1
J. C. Frenckell & Son	c frenckell son	   1
Departament Narodnago prosvêŝenìâ	departament narodnago prosveŝenia	   1
Imperatorskaâ akademìâ nayk''	imperatorskaa akademia nayk''	   1
Gebrüdern Bornträger	gebrudern bornträger	   1
J. Rodwell, and A. Arch	rodwell arch	   1
J. C. Frenckell & son	c frenckell son	   1
tryckt i kongl. fält-tryckeriet	fält-tryckeriet	   1
Boekée	boekee	   1
Christopher and Jennett	christopher jennett	   1
Cadell & Davies	cadell davies	   1
tryckt i Ecksteinska tryckeriet	ecksteinska	   1
Tryckt hos M. E. Iversen	m e iversen	   1
tryckt hos directeur C. F. Berling	directeur c f berling	   1
tryckt hos directeuren och kongl. fält-boktryckaren P. Sohm	directeuren fält-boktryckaren p sohm	   1
tryckt hos Johan Peter Lindh	johan peter lindh	   1
tryckt hos Carl Gustaf Sundqvist	carl gustaf sundqvist	   1
tryckt uti kongl. fält-tryckeriet hos directeuren Peter Sohm	fält-tryckeriet directeuren peter sohm	   1
[imprimée chez Charles Delén]	chez charles delen	   1
prändättyt J. C. Frenckelildä	c frenckelildä	   1
prändätty mag. J. C. Frenckellin tygönä	mag c frenckellin tygönä	   1
präntätty Frenckellin kirjan-präntisä	frenckellin kirjan-präntisä	   1
wastuudest prändätty Frenckellin kirja-prändisä	wastuudest frenckellin kirja-prändisä	   1
prändätty Londicerin kirjan prändisä	londicerin kirjan prändisä	   1
litteris Berglingianis	berglingianis	   1
de l'imprimerie de T. Harper, le Jeune, et Cie. Crane Court, Fleet Street	de de harper le jeune cie crane court fleet street	   1
a la librairie Stéréotype, chez H. Nicolle, rue des Petits-Augustins, no. 15	la librairie stereotype chez h nicolle rue petits-augustins no	   1
tryckt hos Johan Christ. Frenckell & Son	johan christ frenckell son	   1
sumtibus Academiae, impr. J. C. Frenckell, Ac. typ.	academiae c frenckell typ	   1
litteris Joh. Fr. Edman Reg. Acad. typogr.	joh fr edman reg	   1
prändätty Joh. Chr. Frenckellin tykönä	joh chr frenckellin tykönä	   1
prändätty J. C. Frenckellin tygönä	c frenckellin tygönä	   1
tryckt hos directeuren Johoan A. Carlbohm	directeuren johoan carlbohm	   1
trykct i Kongl. tryckeriet	trykct i	   1
tryckt hos direktören Johan A. Carlbohm	direktören johan carlbohm	   1
C. Delén	c delen	   1
tryckte hos Joh. Christopher Frenckell	joh christopher frenckell	   1
Prändätty J. C. Frenckellin ja pojan tykönä	c frenckellin pojan tykönä	   1
tryckte hos directeuren Johan. A. Carlbohm	directeuren johan carlbohm	   1
gedruckt bey Friedrich Drechsler	friedrich drechsler	   1
tryckt uti Kongl. fält-tryckeriet hos directeuren Peter Sohm	fält-tryckeriet directeuren peter sohm	   1
P. Sohm	p sohm	   1
Breitkopf & Härtel, Prix 2 rthlr. 12 gr.	breitkopf härtel prix rthlr gr	   1
Frenckellska tryckeriet	frenckellska	   1
litteris Adami Christiani Charisii Acad. typographi	adami christiani charisii typographi	   1
hos Christ. Ludv. Hjelt	christ ludv hjelt	   1
tryckt hos Henrik And. Nordström	henrik nordström	   1
typis Societatis Biblicae Fennicae	societatis biblicae fennicae	   1
tryckt uti Kongl. Ordens boktryckeriet	ordens	   1
excudebat Zeipel et Palmblad	zeipel palmblad	   1
excudebat Stenhammar et Palmblad	stenhammar palmblad	   1
excudebat Zeipel et Palmblad Reg. Acad. typographi	zeipel palmblad reg typographi	   1
litteris typographorum Academiae Stenhammar et Palmblad	typographorum academiae stenhammar palmblad	   1
tryckt hos Stenhammar och Palmblad, Kongl. Akad. boktryck.	stenhammar palmblad akad boktryck	   1
litteris Joh. Fr. Edman	joh fr edman	   1
impressa apud. Reg. Acad. typ. J. C. Frenckell	reg typ c frenckell	   1
excudebant J. C. Frenckell & fil. Imper. Acad. typographi.	c frenckell fil imper typographi	   1
typis Frenckellanis	frenckellanis	   1
Svâtejšij Pravitel'stvennyj Sinod'	svatejsij pravitelstvennyj sinod'	   1
[Cedervaller]	cedervaller	   1
A. Cederwallerin kirja-painosta	cederwallerin kirja-painosta	   1
Tipografìâ Departamenta vněšnej torgovli	tipografia departamenta vnesnej torgovli	   1
[P. A. Rahmanov]	p rahmanov	   1
Frenckell :;Simelius	frenckell simelius	   1
Tipografìâ Imperatorskoj rossìjskoj akademìi	tipografia imperatorskoj rossijskoj akademii	   1
V' Tipografìi Departamenta vněšnej torgovli	v tipografii departamenta vnesnej torgovli	   1
prändätty Frenckellin kirjan prändisä wuonna	frenckellin kirjan prändisä	   1
[Hörberg]	hörberg	   1
[Cederwaller]	cederwaller	   1
[Hjelt]	hjelt	   1
[toimittaja]	toimittaja	   1
Frenckell ja Poika	frenckell poika	   1
Kun. suomalaisesa kirja-präntisä	kun suomalaisesa kirja-präntisä	   1
A. Cedervaller	cedervaller	   1
[C. A. Gottlund]	c gottlund	   1
pränd. Carl Ant. Londicerildä	carl ant londicerildä	   1
typis C. F. Mohr	c f mohr	   1
tryckt hos Zeipel och Palmblad	zeipel palmblad	   1
tryckt hos Zeipel och Palmblad, Kongl. Acad. boktr.	zeipel palmblad	   1
excudebant Stenhammar et Palmblad Reg. Acad. typogr.	stenhammar palmblad reg	   1
excudebant Stenhammar et Palmblad. Reg. Acad. typographi	stenhammar palmblad reg typographi	   1
excudebant Stenhammar et Palmblad Reg. Acad. typographi	stenhammar palmblad reg typographi	   1
prändätty A. C. Londicerildä	c londicerildä	   1
tryckt hos directeuren och kongl. fält-boktryckaren Peter Sohm	directeuren fält-boktryckaren peter sohm	   1
[tryckte hos mag. Joh. Christoph. Frenckell. För auctorns räkning]	mag joh christoph frenckell för auctorns räkning	   1
tryckt hos J. C. Frenckell, för auktors räkning, och på dess egen bekostnad	c frenckell för auktors räkning pa dess bekostnad	   1
pränttätty direktörin Joh. A. Carlbohmin tykönä	pränttätty direktörin joh carlbohmin tykönä	   1
[J. C. Frencell]	c frencell	   1
J. Simelius	simelius	   1
Chr. Ev. Barck	chr ev barck	   1
And. Cederwaller	cederwaller	   1
präntätty Kuning:sesa suomalaisesa präntisä direktörin Johan A. Carlbohmin tykönä	kuningsesa suomalaisesa präntisä direktörin johan carlbohmin tykönä	   1
präntätty Kuning:sesa suomelaisesa präntisä. direktörin Johan A. Carlbohmin tykönä	kuningsesa suomelaisesa präntisä direktörin johan carlbohmin tykönä	   1
prändätty Kuning:sesa suomalaisesa präntisä, direktörin Johan A. Carlbohmin tykönä	kuningsesa suomalaisesa präntisä direktörin johan carlbohmin tykönä	   1
[präntätty Kuning:sesa suomalaisesa präntisä, direktörin Johan A. Carlbohmin tykönä]	kuningsesa suomalaisesa präntisä direktörin johan carlbohmin tykönä	   1
prändätty Joh. C. Frenckellin tygönä	joh c frenckellin tygönä	   1
[J.C. Frenckell]	jc frenckell	   1
[C. F. Marquard]	c f marquard	   1
litteris J. H. Eckhardt, Reg. Acad. typogr.	h eckhardt reg	   1
litteris, Joh. Fr. Edman, Reg. Acad. typogr.	joh fr edman reg	   1
typis Caroli Delén	caroli delen	   1
prändätty Londicerin lesken tykönä	londicerin lesken tykönä	   1
Tryckte. Hos. J. C. Frenckell	c frenckell	   1
chèz J. C. Frenckell	chez c frenckell	   1
C. Delén & J. G. Forsgren	c delen forsgren	   1
präntätty Kuning:sesa suomalaisesa präntisä, direktörin Joh. A. Carlbohmin tykönä	kuningsesa suomalaisesa präntisä direktörin joh carlbohmin tykönä	   1
[tryckt hos Joh. Christ. Frenckell]	joh christ frenckell	   1
tryckt hos Joh. Pehr Lindh	joh pehr lindh	   1
präntätty Joh. Christ. Frenckellin tykönä	joh christ frenckellin tykönä	   1
prändätty direktörildä ja kuning. suomalaiselda kirja-präntäjäldä Johan A. Carlbohmilda, omalla kulutuxellansa	direktörildä kuning suomalaiselda kirja-präntäjäldä johan carlbohmilda omalla kulutuxellansa	   1
tryckt hos Carl F. Marquard	carl f marquard	   1
tryckte hos Samuel Norberg	samuel norberg	   1
Kuningallisesa suomalaisesa prändisä, directörin Johan A. Carlbohmin omalla kulutuxella	kuningallisesa suomalaisesa prändisä directörin johan carlbohmin omalla kulutuxella	   1
tryckte hos Joh. C. Frenckell	joh c frenckell	   1
[tryckt hos J. C. Frenckell & son]	c frenckell son	   1
tryckt hos mag. Joh. Christ. Frenckell	mag joh christ frenckell	   1
[C. Delén]	c delen	   1
de l'imprimerie de F. Drechsler	de de f drechsler	   1
de l'imprimerie de P. P. A. Pluchart, Petite-Morskoi, No 120	de de p p pluchart petite-morskoi no	   1
präntätty Kuning:sa suomalaisesa präntisä, direktörin Joh. A. Carlbohmin, tykönä	kuningsa suomalaisesa präntisä direktörin joh carlbohmin tykönä	   1
[M. C. Iversen?]	m c iversen	   1
tryckt hos direct. Johan A. Carlbohm	johan carlbohm	   1
[tryckt hos Nils Magn. Lindh]	nils magn lindh	   1
[tryckt i Kongl. Finska Boktryckeriet, hos Johan A. Carlbohm, den 4 feb.]	finska johan carlbohm den feb	   1
gedruckt bey Joh. Friedr. Steffenhagen und Sohn	joh friedr steffenhagen sohn	   1
impensis Petri Kraft, graec. litt. lect.	impensis petri kraft graec litt lect	   1
tryckt på bokhandlaren P. G. Bornwassers bekostnad. I Gresselska tryckeriet	pa bokhandlaren p bornwassers bekostnad i gresselska	   1
prändätty M. C. Iverseldä	m c iverseldä	   1
prändätty Frenckellin kirjan-prdänisä [!]	frenckellin kirjan-prdänisä	   1
pri Svjateišem' Pravitel'stvujuštšem' Sinode	svjateisem' pravitelstvujustsem' sinode	   1
gedruckt bei F. Drechsler	bei f drechsler	   1
gedruckt bei Friedrich Drechsler. Grosse Meschtschanskaja, No 107	bei friedrich drechsler grosse meschtschanskaja no	   1
gedruckt in der Iversenschen Buchdrukkerei	iversenschen buchdrukkerei	   1
gedruckt in der Iversenschen Buchdruckerei	iversenschen buchdruckerei	   1
gedruckt in der Schnoorschen Buchdruckerey	schnoorschen buchdruckerey	   1
tryckt hos Henrik A. Nordström	henrik nordström	   1
tryckt i Gresselska tryckeriet	gresselska	   1
O. Grahn	grahn	   1
gedruckt bey Joh. Chr. Frenckell	joh chr frenckell	   1
[imprimé chez le directeur Pierre Sohm]	chez le directeur pierre sohm	   1
tryckt af directeuren och kongl. fält-boktryckaren Peter Sohm	directeuren fält-boktryckaren peter sohm	   1
präntätty ja ylöspandu directörin Johan A. Carlbohmin tykönä	ylöspandu directörin johan carlbohmin tykönä	   1
prändätty Joh. Chr. Frenckellildä	joh chr frenckellildä	   1
prändätty, Johan Christopher Frenckellildä	johan christopher frenckellildä	   1
Präntätty Kuning:sa suomalaisesa präntisä, direktörin Joh. A. Carlbohmin tykönä	kuningsa suomalaisesa präntisä direktörin joh carlbohmin tykönä	   1
J. C. Frenckellin kirjan-prändisä	c frenckellin kirjan-prändisä	   1
präntätty direktörin Johan A. Carlbohmin tykönä	direktörin johan carlbohmin tykönä	   1
prändätty J.C. Frenckellin tykönä	jc frenckellin tykönä	   1
Joh. Ch. Frenckellin kirjanprändisä	joh ch frenckellin kirjanprändisä	   1
prändätty Kunningallisesa suomalaisesa präntisä, direktörin Joh. A. Carlbohmin tykönä	kunningallisesa suomalaisesa präntisä direktörin joh carlbohmin tykönä	   1
prändätty Joh. Christ. Frenckellin tykönä	joh christ frenckellin tykönä	   1
Prändätty J. C. Frenckellin tykönä	c frenckellin tykönä	   1
prändätty Kuningallisesa suomalaisesa prändisä, direktorin Joh. Arv. Carlbohmin tykönä	kuningallisesa suomalaisesa prändisä direktorin joh arv carlbohmin tykönä	   1
prändätty Iverseldä	iverseldä	   1
tryckt, enligt skriftelig befallning, hos J. C. Frenckell	enligt skriftelig befallning c frenckell	   1
prändätty kirjallisen käskyn jälkeen J. C. Frenckellildä	kirjallisen c frenckellildä	   1
tryckt hos Joh. Ch. Frenckell, på egen bekostnad	joh ch frenckell pa bekostnad	   1
tryckt hos J. Simelius	simelius	   1
tryckta uti Bibel-sällskapets boktryckeri	tryckta bibel-sällskapets	   1
tryckte hos Joh. C. Frenckell & son	joh c frenckell son	   1
[tryckt hos Johan Christ. Frenckell]	johan christ frenckell	   1
Em. Bruzelius	em bruzelius	   1
tryckt hos Christ. Ludv. Hjelt	christ ludv hjelt	   1
typis Frenckell & fil.	frenckell fil	   1
J. C. Frenckell & filius	c frenckell filius	   1
tryckt hos Johan Christ. Frenckell & son	johan christ frenckell son	   1
gedruckt bei J. C. Frenckell	bei c frenckell	   1
tryckt hos Christian Ludw. Hjelt, på eget förlag	christian ludw hjelt pa eget förlag	   1
tryckt hos Christian Ludw. Hjelt. På utgifvaren G. M. Järnefelts förlag	christian ludw hjelt pa utgifvaren m järnefelts förlag	   1
tryckt hos Christian Ludw. Hjelt.	christian ludw hjelt	   1
tryckte hos J. C. Frenckell & son.	c frenckell son	   1
excudebant J. C. Frenckell & fil. Imp. Academiae typographi	c frenckell fil academiae typographi	   1
tryckt hos Joh. Christoph. Frenckell & son.	joh christoph frenckell son	   1
typis Joh. Ch. Frenckell et fil.	joh ch frenckell fil	   1
in officina typographica Societatis Biblicae	typographica societatis biblicae	   1
typis Frenckelianis	frenckelianis	   1
ex officina Joh. Ch. Frenckell	joh ch frenckell	   1
In officina Frenckelliana	frenckelliana	   1
in offinica Frenckelliana	offinica frenckelliana	   1
typis Joh. Christoph. Frenckell & filii	joh christoph frenckell filii	   1
typis Frenkelliorum	frenkelliorum	   1
excudebant J. C. Frenckell & fil. Acad. imper. typographi	c frenckell fil imper typographi	   1
J. C. Frenckell ja poika	c frenckell poika	   1
chez I. Covens et C. Mortier avec privilege	chez i covens c mortier avec privilege	   1
printed for H. Moll over against Devereux Court without Temple Bar in the Strand Iohn Bowles over-against Stocks Market, Thomas Bowles print & mapseller next to the Chapter House in S.t Pauls Church yard and by Philip Overton map & printseller near S. Dunstans Church Fleetstreet	h moll over against devereux court without temple bar strand iohn bowles over-against stocks market thomas bowles mapseller next chapter house st pauls church yard philip overton map printseller near dunstans church fleetstreet	   1
[C. Weigel]	c weigel	   1
[William Innys ... et al.]	william innys al	   1
Wm. Faden	wm faden	   1
[John Senex]	john senex	   1
printed for Rob.t. Sayer	robt sayer	   1
printed for Robert Sayer	robert sayer	   1
par Francois Santini rue St. Justine prés de L'Eglise. Chez Mr. Remondini	par francois santini rue st justine pres de leglise chez mr remondini	   1
uti Kongl. landmäterie contoiret	landmäterie contoiret	   1
[Per Brahe]	per brahe	   1
[Sumptibus et typis aeneis Judoci Hondij]	aeneis judoci hondij	   1
[Joannes Janssonius & Henricus Hondius]	joannes janssonius henricus hondius	   1
[Sumptibus et typis aeneis Iudoci Hondij]	aeneis iudoci hondij	   1
verlegt beÿ Christoph Riegel Buch- und Kunsthändlern	verlegt beÿ christoph riegel buch- kunsthändlern	   1
impressum â Petro Hansonio	petro hansonio	   1
[Joseph Philipp Schalbacher]	joseph philipp schalbacher	   1
[Dankerts]	dankerts	   1
[J. Janssonius]	janssonius	   1
[M. Merian]	m merian	   1
[Johann Bussemacher]	johann bussemacher	   1
par Le Rouge, rue des Grands Augustins	par le rouge rue grands augustins	   1
chez J. Cóvens et C. Mortier	chez covens c mortier	   1
Apud autorem cum privilegio annorum viginti et apud Petrum Mariette via Iacobaea sub signo spei	autorem annorum viginti petrum mariette via iacobaea sub signo spei	   1
sumptibus Ioannis Ianssonii	ioannis ianssonii	   1
[Kongl. Landtmät. Contoiret]	landtmät contoiret	   1
[Akademia Nauk]	akademia nauk	   1
Ioh. Georg Probst	ioh georg probst	   1
I. Covens et C. Mortens	covens c mortens	   1
excud. Joh. Kiaempe, Reg. Ac. typogr.	joh kiaempe reg	   1
tryckt hos Kgl. Acad. boktr. J. C. Frenckells enka	kgl c frenckells	   1
impressit Joh. Christ. Frenckell, Reg. Acad. typogr.	joh christ frenckell reg	   1
omtryckt hos Andreas Holmerus	andreas holmerus	   1
excusa à Iohanne Winter, Reg: typogr. Finlandiae	iohanne winter reg finlandiae	   1
excudit Johannes Wall Larsson, Regiae Univ. ibid. typogr.	johannes wall larsson univ ibid	   1
ex officina Frid. Wilh. Meyeri	frid wilh meyeri	   1
impr. apud Johannem Wallium, Reg. Univ. ib. typogr.	johannem wallium reg univ ib	   1
impr. apud Joh. L. Walilum[!], A. t.	joh l walilum! t	   1
tryckt af Joh. Kämpe, Kongl. Acad. bokt.	joh kämpe bokt	   1
exc. apud Jo. L, Wallium	jo l wallium	   1
excudebat Petrus Wald acad. typogr.	petrus wald	   1
hos K. Acad. boktryckaren Joh. C. Frenckells enka	k joh c frenckells	   1
tryckt hos Joh. Laur. Horrn, kongl. consist. och gymn. boktr.	joh laur horrn consist	   1
[in Erlegung Martin Hallervorden, Buchhändlern zu Köningsberg in Preussen. Gedruckt bey Johann Andre]	erlegung martin hallervorden köningsberg preussen johann andre	   1
[chez la veuve Olivier de Varennes, au Palais dans la Salle royale, au Vase d'or]	chez la veuve olivier de varennes au palais dans la salle au vase d'or	   1
[by Jan ten Hoorn, boekverkooper, over't Oude Heeren Logement]	jan ten hoorn boekverkooper over't oude heeren logement	   1
[tryckt på direct. Lars Salvii förlag]	pa lars salvii förlag	   1
typis Joann. Christian. Dietrich	joann christian dietrich	   1
sumt: et inv: J: L: Er: f.	sumt inv l er f	   1
[S. Münster]	munster	   1
excudit And: Biörkman, univ. typ.	biörkman univ typ	   1
aff Jacobo Pistorio	jacobo pistorio	   1
impr. apud Jo. Laur. Wall	jo laur wall	   1
å nyo uplagt i framledne direct. Lars Salvii tryckeri	i framledne lars salvii tryckeri	   1
printed for T. Cox; C. Davis; J. and P. Knapton; and A. Millar	cox c davis p knapton millar	   1
impressum â Joh. Henr. Werner, reg. typogr.	joh henr werner reg	   1
tryckt hos direct. Johan Edman	johan edman	   1
tryckt hos Lorentz L. Grefing	lorentz l grefing	   1
präntätty Johann Köhlerildä	johann köhlerildä	   1
tryckt hos Anders J. Nordström	anders nordström	   1
trÿckt hos P. I. Nÿström, 1741. och fines hos honom til kiöps	trÿckt p i nÿström fines honom til kiöps	   1
