catalog	author	short_title	title	dissertation	publication_place	publication_year
Kungliga	Bilmark, Johan (1728-1801)	Academisk afhandling innehållande några anmärkningar 	Academisk afhandling innehållande några anmärkningar vid domareembetet ... under ... Johan Bilmarks inseende, til allmän granskning framgifven af Eric Johan Arppe, björneborgs-bo, i Åbo academies öfre läro-sal den 24 maj 1776. förmiddagen	NA	Turku	1776
Kungliga	Kalm, Pehr (1716-1779)	Academisk afhandling om fängelser	Academisk afhandling om fängelser	FALSE	Turku	1776
Kungliga	Wellingk, Eric Adolph	Supplement til Den svenska soldatens 	Supplement til Den svenska soldatens förbättrade öde. Åbo, tryckt hos Johan Christopher Frenckell, 1776	FALSE	Turku	1776
Kungliga	Kreander, Johannes	Theses de institutione juventitis	Theses de institutione juventitis	TRUE	Turku	1776
Kungliga	NA	Underrrättelse om sättet at bota 	Underrrättelse om sättet at bota rödsoten. =(Rubr.)= (Åbo, tryckt hos Joh. Chirstoph [!] . Frenckell, kongl. acad. boktr.	FALSE	Turku	1776
Kungliga	Tidgren, Gabriel (1743-1788)	Dissertatio de eloquentia veterum Suio-Gothorum	Dissertatio de eloquentia veterum Suio-Gothorum	TRUE	Turku	1777
Kungliga	Kalm, Pehr (1716-1779)	En kort afhandling om boställs 	En kort afhandling om boställs förläningens nytta i landthushållningen, med wederbörligt samtycke, under ... Pehr Kalms inseende, för lager-kransen, utgifwen och författad af Alexander Saurén, g.o.t. uti Åbo Akademiens öfre läro-sal den 12 November 1777. f.m	NA	Turku	1777
Kungliga	Haartman, Jacob (1717-1788)	Tal, hållit wid präste-ordination här 	Tal, hållit wid präste-ordination här i Åbo dom-kyrka den 6 april 1777. Af underteknad biskop. =(Rubr.)=/(Jac. J. Haartman.) (Åbo, tryckt 1777. Hos kgl. ac. boktr. J.C. Frenckell.	FALSE	Turku	1777
Kungliga	Gadd, Pehr Adrian (1727-1797)	=Upmuntran och underrättelse til nyttiga 	=Upmuntran och underrättelse til nyttiga plantagers widtagande i Finland. 1-12. 1763-78.=	FALSE	Turku	1778
Kungliga	Nordenskjöld, August	Bergs-kunskapen i hela dess vidd, 	Bergs-kunskapen i hela dess vidd, innefattas i följande vettenskaper och konster	FALSE	Turku	1778
Kungliga	Nordenskiöld, August (1754-1792)	Bergs-kunskapen i hela desz widd, 	Bergs-kunskapen i hela desz widd, innefattas i följande wettenskaper och konster. =(Rubr.) Anon=. (Åbo, tryckt hos kongl. acad. boktryckaren Johan Chr. Frenckell, år 1778.	FALSE	Turku	1778
Kungliga	Gadd, Pehr Adrian (1727-1797)	Botanico oeconomisk afhandling, om Asclepias 	Botanico oeconomisk afhandling, om Asclepias Syriaca, med vederbörandes samtycke vid kongl. lärosätet i Åbo, under plantage directeuren i Finland, chemie professoren, riddaren af Kongl. Wasa Orden, ledamoten af Kongl. Svenska Vettenskaps Academien, Upsala Lärda Societeten, Kongl. Svenska Patriotiska Sällskapet, samt vitterhets och vettenskaps samhället i Götheborg herr Pehr Adrian Gadds inseende, för lager-kransen utgifven och försvarad af Johan Christopher Frenckell, sonen, Åbo-bo. I Åbo Academiens öfre läro-sal den 16 Junii 1778. P. v. t. f. m	NA	Turku	1778
Kungliga	Kalm, Pehr (1716-1779)	Dissertatio gradualis de præjudiciis oeconomiæ 	Dissertatio gradualis de præjudiciis oeconomiæ noxiis. Part prima, quam adnuente amplissima facultate philosoph. præside ... Petro Kalm, examinandam exhibet Rudolphus Josephus Estlander, ostrobotniensis. In auditorio majori die XXIII junii, MDCCLXXVIII	NA	Turku	1778
Kungliga	NA	Sinnebild öfver vår frälsares Jesu 	Sinnebild öfver vår frälsares Jesu Christi kors, utgifven af M.A. år 1779. =(Rubr.)= (Tryckt i Åbo hos kongl. acad. boktryckaren Joh. Christ. Frenckells enka, år 1779.	FALSE	Turku	1779
Kungliga	NA	Uskon ja rakkauden silmäminen Herran 	Uskon ja rakkauden silmäminen Herran Jesuxen puoleen ristin päällä: ruotzista suomexi käätty	FALSE	Turku	1779
Kungliga	Hellens, Carl Niclas Von (1745-1820)	Anmärkningar öfver finska allmogens bryggningssätt, 	Anmärkningar öfver finska allmogens bryggningssätt, med philosophiska facultetens samtycke, wid Kongl. academien i Åbo, til allmän granskning förestälde af Carl Niclas Hellenius ... och Reinhold Wilhelm Stierwald, österbotning. Uti öfre läro-salen den 5 april 1780. På wanlig tid förmiddagen	NA	Turku	1780
Kungliga	Haartman, Jacob (1717-1788)	Tal, hållit wid präste-ordination i 	Tal, hållit wid präste-ordination i Åbo, den 15 december 1779. Af Jacob J. Haartman ... =(Rubr.)= [Åbo, J.C. Frenckell, 1780.	FALSE	Turku	1780
Kungliga	Reinius, Israel M Attsson	Yxikertaiset kysymyxet juopumisesta, 1755	Yxikertaiset kysymyxet juopumisesta, 1755	FALSE	Turku	1780
Kungliga	Porthan, Henrik Gabriel (1739-1804)	Dissertatio academica, exhibens cogitata quædam, 	Dissertatio academica, exhibens cogitata quædam, educationem juventutis publicam in scholis inferioribus, spectantia; cujus partem priorem, consent. ampliss. facult. philosoph. in Reg. Acad. Aboënsi, præside mag. Henrico Gabriele Porthan, eloqu. profess. reg. et ord. Pro gradu publice ventilandam sistit Josephus Mollin, coll. infer. scholæ triv. Wasens. In auditorio majori die [ ] anno MDCCLXXXI. H. a. m. c	NA	Turku	1781
Kungliga	Gadd, Pehr Adrian (1727-1797)	Metallurgisk afhandling om myrjärnets tilvärckning	Metallurgisk afhandling om myrjärnets tilvärckning	FALSE	Turku	1781
Kungliga	Hellens, Carl Niclas Von (1745-1820)	Afhandling om de allmännaste djurfången 	Afhandling om de allmännaste djurfången i Tavastland	FALSE	Turku	1782
Kungliga	österman, Bengt	Alphabetiskt register, öfwer 20. §. 	Alphabetiskt register, öfwer 20. §. af kongl. maj:ts nådige förordning, daterad den 14. januarii 1748, samt desz och rikets höglofl. cammar collegii circulaire bref, til öfwer-ståthållare embetet, och samtelige herrar landshöfdingar	FALSE	Turku	1782
Kungliga	NA	Miss Prices äfwentyr. Öfwersättning. Åbo, 	Miss Prices äfwentyr. Öfwersättning. Åbo, tryckt hos kgl. acad. boktr. J.C. Frenckells encka, år 1782	FALSE	Turku	1782
Kungliga	NA	Nöjsamma småheter. Åbo, tryckt hos 	Nöjsamma småheter. Åbo, tryckt hos kongl. acad. boktr. Joh. C. Frenckells enka. =1. 1782=	FALSE	Turku	1782
Kungliga	Edelcrantz, Abraham Niclas (1754-1821)	Sorge-tal, öfver högstsalig hennes kongl. 	Sorge-tal, öfver högstsalig hennes kongl. majestät enke-drottningen, Lovisa Ulrica, hållit i Åbo academies öfre lärosal den 30 octob. 1782. Af Abraham Niclas Clewberg. Åbo tryckt hos kongl. acad. boktr. Joh. C. Frenckells enka, på kongl	FALSE	Turku	1782
Kungliga	Lohman, Diedrich Johannes	Specimen academicum meditationes quasdem circa 	Specimen academicum meditationes quasdem circa institutionem juventutis continens	FALSE	Turku	1783
Kungliga	Bergman, Johan Gabriel (1732-1793)	Underrättelse, om rätta sättet at 	Underrättelse, om rätta sättet at förekomma och bota rödsoten, utgifwen af Joh. Gabr. Bergman ... =(Rubr.)= (Tryckt i Åbo hos kongl. acad. boktr. J.C. Frenckells enka, 1783.	FALSE	Turku	1783
Kungliga	Hägg, Carl (1753-1829)	En försummad och förwänd barna-upfostran, 	En försummad och förwänd barna-upfostran, med desz osaliga påfölgder, förestäld på midsommarsdagen år 1784. Uti Sunds kyrka på Åland, af Carl Hägg ... Åbo, tryckt hos kongl. acad. boktr. J.C. Frenckells enka, 1784	FALSE	Turku	1784
Kungliga	NA	Helsingfors stads brand-ordning, af borgmästare 	Helsingfors stads brand-ordning, af borgmästare och råd, efter öfwerläggning med borgerskapets äldre författad år 1782, och af Kongl. Maj:t til obrottslig efterlefuad [!] i nåder gillad och stadfästad den 27 februarii år 1784	FALSE	Turku	1784
Kungliga	NA	Kongl Åbo hof-rätts universaler. =Åbo. 	Kongl Åbo hof-rätts universaler. =Åbo. 1-2. 1784-89.=	FALSE	Turku	1784
Kungliga	NA	Förtekning på böcker, som i 	Förtekning på böcker, som i St. Pettersburg komma at försäljas på öpen auction den 178 . =(Rubr.)= (Tryckt i Åbo, hos k. acad. boktryckaren Joh. C. Frenckells enka, 1785.	FALSE	Turku	1785
Kungliga	Nohrborg, Anders (1725-1767)	Guds oförskylda nåd i Christo, 	Guds oförskylda nåd i Christo, som wederfars en arm syndare uti des rättfärdiggörelse inför Gud, afhandlat uti tre predikningar af sal. ... Anders Nohrborg, 1. På 11:te söndagen efter trinitatis 2. På söndag. septuagesima 3. På andra	FALSE	Turku	1785
Kungliga	Franzén, Frans Michael (1772-1847)	Dissertatio academica [præs	Dissertatio academica [præs	FALSE	Turku	1786
Kungliga	Tidgren, Gabriel (1743-1788)	Dissertatio gradualis, quæstionem: an mons 	Dissertatio gradualis, quæstionem: an mons Sevo in Scandinavia quærendus sit, exhibens, quam, consensu ampl. fac. philos. in reg. acad. Aboënsi, præside mag. Gabriele Tidgren ... publicæ disquisitioni committit Fredericus Ehrenmalm, nobilis, in auditorio majori, die X Junii anni MDCCLXXXVI, horis ante meridiem solitis	NA	Turku	1786
Kungliga	NA	Kongl. maj:ts nådiga circulaire til 	Kongl. maj:ts nådiga circulaire til Consistorium Eccl. i Åbo, af den 21. augusti 1786	FALSE	Turku	1786
Kungliga	Gadd, Pehr Adrian (1727-1797)	Om medel at kunna förekomma 	Om medel at kunna förekomma flodvatnets öfversvämningar	TRUE	Turku	1786
Kungliga	Kreander, Salomon (1755-1792)	Academisk afhandling innehållande anmärkningar uti 	Academisk afhandling innehållande anmärkningar uti byggnings-konsten i allmänhet och den finska i synnerhet; hvaraf I:a del. Med philosophiska facultetens bifall, under ... Salomon Kreanders inseende, utgifves och försvaras af Isaak Erik Estlander, österbotninge. I Åbo Academiens öfre-lärosal den 20 dec. 1787. På vanlig tid för midd	NA	Turku	1787
Kungliga	Bonsdorff, Jacob (1763-1831)	Christi död. Sorgedikt. =Anon.= Åbo, 	Christi död. Sorgedikt. =Anon.= Åbo, trykt i Frenckellska boktr. 1787	FALSE	Turku	1787
Kungliga	Eenquist, Abraham (1755-1791)	Dissertatio academica, educationem publicam : 	Dissertatio academica, educationem publicam : præstantissimum esse vitiorum submovendorum auxilium, demonstrans, quam auctoritate rever. d:ni episcopi & pro-cancellarii, nec non summe vener. cons. eccl. pro examine subeundo pastorali munereque superiori in scholis publ. obtinendo publico examini subjicit Abrahamus Eenquist phil. mag. et coll. inf. Scholae Triv. Wasensis, respondente Johanne Ahlstubbe stip. reg. Ostrobotn. in audit. majori die XXIV Nov. MDCCLXXXVII. H. a. m. s	NA	Turku	1787
Kungliga	Bergman, Johan Gabriel (1732-1793)	En kortt underrättelse, hwaraf första 	En kortt underrättelse, hwaraf första afdelningen, innehåller de upgifter, hwilka böra utredas, då farsoter af wederbörande inberättas, och den andra, råd och föreskrifter, tienliga uti den på flera ställen i Åbo län nu för tiden gångbara	FALSE	Turku	1787
Kungliga	Gadd, Pehr Adrian (1727-1797)	Inledning til sten-rikets känning, efter 	Inledning til sten-rikets känning, efter samlade rön och anmärkningar, academiske ungdomen til tjenst, författad och utgifwen af Pehr Adrian Gadd. ... Åbo, tryckt i Frenckellska boktryckeriet år 1787, på egen bekostnad	FALSE	Turku	1787
Kungliga	Mannerskants, Nils (1738-1809)	Aftryck af et från Finland 	Aftryck af et från Finland ankommet bref, angående åtskilliga stämplingar, samt hwad som händt wid Fredrikshamns belägring. Jämte en tilläggning i samma ämne, samt åtskillige andra nyheter rörande kriget. Och sluteligen hr. regements	FALSE	Turku	1788
Kungliga	Godenius, Daniel (1702-1768)	Ensimmäiset bokstawit Jumalan sanasta, elikä 	Ensimmäiset bokstawit Jumalan sanasta, elikä lasten-kysymyxet se on ne ensimäiset ja yxinkertaisimat kysymyxet christillisydestä, joidenga yhdistetyt wastauxet pitä sisälle painettaman lasten ymmärryxeen ja muistohon, siitä kuin he alkawat puhumaan, sihen asti kuin he owat oppinet a.b.c. kirjan ja catechismuxen ulkoa ja sisäldä; edesannetut, yxinkertaisille, mutta kuitengin lembiöille wanhemille ja niille palweluxexi, jotka yhteisestä kansasta opettawat lapsia lukeman kirjaa, ja itze kuitengan ei ole sijtä opusta, että he taidaisit tehdä wähäisiä kysymyxiä ja sopiwaisia lyhykäisiä wastauxia. Daniel Godeniuxelda. Prowasti ja kirkoherra Malungisa. Ruotzista suomexi käätty H: H: F	FALSE	Turku	1788
Kungliga	Lidner, Bengt (1757-1793)	Ode til finske soldaten. Af 	Ode til finske soldaten. Af Lidner. Åbo, tryckt i Frenckellska tryckeriet. 1788	FALSE	Turku	1788
Kungliga	Nordforss, Carl Gustaf (1763-1832)	Ode/ til svenska armeen. =Anon=. 	Ode/ til svenska armeen. =Anon=. Åbo, tryckt i Frenckellska boktryckeriet 1788	FALSE	Turku	1788
Kungliga	NA	Reglemente, hvarefter tiänstgöringen kommer at 	Reglemente, hvarefter tiänstgöringen kommer at bestridas under expeditionen med kongl. arméens flåttas finska escadre år 1788. Åbo, tryckt i Frenckellska boktryckeriet	FALSE	Turku	1788
Kungliga	NA	Signal bref för kongl. armeéns 	Signal bref för kongl. armeéns flåtta under expedition år 1788. Åbo, tryckt i Frenckellska boktryckeriet	FALSE	Turku	1788
Kungliga	NA	Sota-artikelit jotka...Carle XI:dä...vuonna 1683 uudistetut 	Sota-artikelit jotka...Carle XI:dä...vuonna 1683 uudistetut ja vahvistetut ovat:nyt...suomexi käätyt	FALSE	Turku	1788
Kungliga	Gadd, Pehr Adrian (1727-1797)	Underrättelse för allmogen, at med 	Underrättelse för allmogen, at med sädens mästa besparing tilwerka bränwin. Författad af Pehr Adrian Gadd ... Åbo, tryckt i Frenckellska boktryckeriet 1788	FALSE	Turku	1788
Kungliga	Lidner, Bengt (1757-1793)	Yttersta domen. Skaldstycke af Lidner. 	Yttersta domen. Skaldstycke af Lidner. Åbo, tryckt i Frenckellska tryckeriet MDCCLXXXVIII	FALSE	Turku	1788
Kungliga	Bonsdorff, Gabriel Von (1762-1831)	Differentiæ capitis insectorum præcipuæ, exemplis 	Differentiæ capitis insectorum præcipuæ, exemplis illustratæ, quas dissertatione academica venia ampl. fac. phil. Aboëns. praeside d:no Gabriele Bonsdorff ... pro gradu publicæ censuræ offert Ulricus Pryss, stip. Ekest., Svio-Gothus. In auditorio majori die XXX Maji an. MDCCLXXXIX	NA	Turku	1789
Kungliga	Bilmark, Johan (1728-1801)	Dissertatio academica de prætenso pontificis 	Dissertatio academica de prætenso pontificis Romani in regnum Neapolitanum jure, quam venia ampl. facultatis philosophicæ in reg. academ. Aboënsi, præside mag. Johanne Bilmark, histor. ac philosoph. pract. professore reg. et ord. pro gradu publice ventilandam exhibet Abrahamus Burman, Jemtlandus. In audit. maj. die XXVII Maji. an. R. S. MDCCLXXXIX. H. A. M. S	NA	Turku	1789
Kungliga	Kreander, Salomon (1755-1792)	Dissertatio gradualis, de præjudiciis oeconomiæ 	Dissertatio gradualis, de præjudiciis oeconomiæ noxiis, pars secunda quam adnuente amplissima fac. philos. præside mag. Salomone Kreander, oeconom. profess. reg. & ord. reg. soc. patr. Svec. membro, examinandam exhibet Isaacus Ericus Estlander, Ostrobotniensis, in auditorio majori die VIII Julii an. MDCCLXXXIX, H. A. M. C	NA	Turku	1789
Kungliga	Bilmark, Johan (1728-1801)	Dissertatio historica, continens Examen hypotheseos 	Dissertatio historica, continens Examen hypotheseos de commerciis Phœnicum cum veteribus Fennis	NA	Turku	1789
Kungliga	NA	Kongl Åbo hof-rätts universaler. =Åbo. 	Kongl Åbo hof-rätts universaler. =Åbo. 1-2. 1784-89.=	FALSE	Turku	1789
Kungliga	NA	Krigs-articlar som af den stormägtigste 	Krigs-articlar som af den stormägtigste konung och herre, herr Carl den XI. Sweriges, Göthes och Wendes konung &c. &c. &c. förnyade och stadgade äro, på Stockholms slott, den 2. martii 1683. Nu på högwederbörlig befallning å nyo uplagde. Åbo, tryckt hos k. acad. boktryckaren mag. J.C. Frenckell 1789	FALSE	Turku	1789
Kungliga	NA	Kuning. Maj:tin Armollinen Julistus, Yhteiselle 	Kuning. Maj:tin Armollinen Julistus, Yhteiselle Kansalle, Turun ja Björneborin, Uudenmaan ja Hämen-Linnan, niin myös Kymmenegårdin Läänisä. Enämmästä niin Kutzutusta Apuwäestä Kaupungeisä ja Fästningeisä Suomen-Maasa Annettu Borgosa 10 päiwänä Kesä-Kuusa Wuonna 1789	FALSE	Turku	1789
Kungliga	NA	Kuning:sen Maj:tin Armollinen Julistus, Nijlle 	Kuning:sen Maj:tin Armollinen Julistus, Nijlle Suomen maan Asujamille, jotka ennen tätä owat olleet Ruotsin Waldakunnan Alimmaiset; Mutta nyt huokawat wierahan ikeen alla, Annettu Leirisä Mäkikoufwolan tykönä sinä 1. p. Heinä-Kuusa, Wuonna 1789	FALSE	Turku	1789
Kungliga	NA	Kuning:sen Maj:tin Placati, Neljästä Yhteisestä, 	Kuning:sen Maj:tin Placati, Neljästä Yhteisestä, Julki- Kiitos- Katumus- Paasto- ja Rukous-Päiwästä, Jotka Yli koko Ruotzin Waldakunnan, Suuren Ruhtinan Maan Suomen, kaikkein Ruotzin Kruunun omisa ja sen alla olewain Ruhtinan Maitten, Maakundain ja Herrain Waldain, juhlallisesti pidettämän ja wietettämän pitä tulewana Wuonna 1790. Annettu Stockholmin Linnasa sinä 4 päiwänä Joulu-Kuusa 1789	FALSE	Turku	1789
Kungliga	Horatius Flaccus, Quintus	Liber de arte poetica	Liber de arte poetica	FALSE	Turku	1789
Kungliga	NA	Meidän vapahtajamme Jesuxen Christuxen kärsimisen 	Meidän vapahtajamme Jesuxen Christuxen kärsimisen ja kuoleman tutkistelemus .	FALSE	Turku	1789
Kungliga	Ganander, Christfrid (1741-1790)	Mythologia fennica, eller Förklaring öfver 	Mythologia fennica, eller Förklaring öfver de nomina propria deastrorum, idolorum, locorum, virorum &c. eller afgudar och afgudinnor, forntidens märkelige personer, offer och offer-ställen, gamla sedvänjor	FALSE	Turku	1789
Kungliga	Malmström, Pehr (1758-1834)	Specimen poëseos Pindaricæ in Latinum 	Specimen poëseos Pindaricæ in Latinum conversæ, cujus particulam primam, venia ampl. facult. philos. Aboëns. Publice exhibent mag. Petrus Malmström ... et Gabriel Krogius, Wiburgensis. In audit. min. d. XX. Jun. MDCCLXXXIX. H. ante merid. s	NA	Turku	1789
Kungliga	Nathorst, Johan Theophilus (1760-1798)	Tal, hållit på konungens födelse 	Tal, hållit på konungens födelse dag, den 24 januarii 1789. Uti gillet Kärleken til nästan, i Lovisa. =Anon=. Åbo, tryckt i Frenckellska boktryckeriet 1789	FALSE	Turku	1789
Kungliga	Gadd, Pehr Adrian (1727-1797)	Undersökning om Nyland och Tavastehus 	Undersökning om Nyland och Tavastehus län	NA	Turku	1789
Kungliga	NA	Berättelse om swenska arméens attaque 	Berättelse om swenska arméens attaque och seger den 29 april 1790, öfwer en wida talrikare rysk corps, wid Walkiala kyrka, uti Ryszland. Åbo, tryckt i Frenckellska boktryckeriet	FALSE	Turku	1790
Kungliga	Ignatius, Bengt Jacob (1761-1827)	Den rättfärdige Gudens hämde-domar öfwer 	Den rättfärdige Gudens hämde-domar öfwer et syndigt folk, förestälde i anledning af evang. på 25 söndagen efter trinitatis uti en wecko-predikan i Åbo dom-kyrka år 1789, och på begäran til trycket lämnad af Bengt Jacob Ignatius. Åbo	FALSE	Turku	1790
Kungliga	Burman, Abraham (1765-1814)	Dissertatio academica, examen fontium historiæ 	Dissertatio academica, examen fontium historiæ Svecanæ antiquæ sistens, quam, cons. ampliss. fac. phil. in reg. acad. Aboënsi, publice examinandam sistunt Abrahamus Burman phil. mag. et Sveno Blomberg stip. reg. Sveco-Smolandus. In auditorio majori, die XII Junii an. MDCCXC. Horis ante merid. solitis	NA	Turku	1790
Kungliga	Mallet Du Pan, Jacques (1749-1800)	Europan waldakundain tasa-woiman waarasta. Suomexi 	Europan waldakundain tasa-woiman waarasta. Suomexi käätty ja präntijn toimitettu Eric Polonilda	FALSE	Turku	1790
Kungliga	NA	K. General krigs-rättens i arméen 	K. General krigs-rättens i arméen dom, ang. herr general majoren... baron Lars Fredric Kaulbars, hvilken för åtskillige uti tjensten begångne förseelser blifvit anklagad	FALSE	Turku	1790
Kungliga	NA	Kongl. general krigs-rättens i arméen 	Kongl. general krigs-rättens i arméen dom, angående herr general majoren ... Lars Fredric Kaulbars, hwilken, för åtskillige uti tjensten begångne förseelser, blifwit anklagad. Afkunnat i lägret wid Värelä den 17. sept. 1789. Åbo, tryckt i Frenckellska boktryckeriet 1790	FALSE	Turku	1790
Kungliga	NA	Protocoller, hållne uti K.General krigs-rätten 	Protocoller, hållne uti K.General krigs-rätten i arméen, rörande herr general majoren...Lars Fredric Kaulbars retraite från Mäkikauvala och Wärelä under 1789 års fälttåg, hvarföre han varit under tiltal stäld	FALSE	Turku	1790
Kungliga	NA	Protocoller, hållne uti kongl. general 	Protocoller, hållne uti kongl. general krigs-rätten i arméen, rörande herr general majoren och commendeuren ... Lars Fredric Kaulbars retraitte från Mäkikauvala och Wärelä under 1789 års fälttåg, hwarföre han warit under tiltal stäld. Åbo, tryckte i Frenckellska boktryckeriet 1790	FALSE	Turku	1790
Kungliga	Ingman, Alexander (1758-1795)	Tal, vid tilfälle af förenings 	Tal, vid tilfälle af förenings och säkerhets actens firande i Åbo den 3:die april 1790, hållit i kongl. academiens öfre lärosal af Alexander Ingman ... Åbo, tryckt i Frenckellska boktryckeriet 1790	FALSE	Turku	1790
Kungliga	NA	Yhden rakastetun äitin ero tästä 	Yhden rakastetun äitin ero tästä viheljäisyydestä, joka tapahtui s. 11. päiv. Kesä-kuusa 1790	FALSE	Turku	1790
Kungliga	Porthan, Henrik Gabriel (1739-1804)	Dissertatio academica de ct aro 	Dissertatio academica de ct aro [dvs arcto] musices cum ingenio humano nexu, ejusque ad hoc excolendum momento. Cujus partem priorem suffrag. ampliss. facult. philos. in Reg. Acad. Aboënsi, præside mag. Henrico Gabriele Porthan, eloqv. prof. reg. & ord. R. acad. litt. human. hist. & antiquitt. membro, pro laurea publice ventilandam sistit Johannes Nicol. Snellman, stip. reg. Ostrobotniensis, in audit. maj. die XIV Decembris an. MDCCXCI, h. a. m. c	NA	Turku	1791
Kungliga	Selander, Johan (1760-1804)	Meditationes nonnullæ de lingvarum hodiernarum 	Meditationes nonnullæ de lingvarum hodiernarum studio scholis inferendo, quas cons. ampl. fac. phil. reg. acad. Ab. publico examini subjiciunt Johannes Selander, phil. mag. et Isaacus Forsell, stip. reg, Satacundensis. In audit. maj. die XXI. Junii MDCCXCI. H. A. M. S	NA	Turku	1791
Kungliga	Weman, Carl Gustaf (1740-1803)	Predikan, wid prästmötet i Åbo, 	Predikan, wid prästmötet i Åbo, den 3 september 1791, hållen af Carl Gustaf Weman. ... Åbo, tryckt i Frenckellska boktryckeriet	FALSE	Turku	1791
Kungliga	Hellens, Carl Niclas Von (1745-1820)	Dissertatio academica sistens specimina quædam 	Dissertatio academica sistens specimina quædam instinctus, quo animalia suæ prospiciunt soboli	FALSE	Turku	1792
Kungliga	Bonsdorff, Gabriel Von (1762-1831)	Dissertatio academica, fabricam, usum & 	Dissertatio academica, fabricam, usum & differentias palporum in insecti exponens	FALSE	Turku	1792
Kungliga	Ernesti, Johann August (1707-1781)	Initia rhetorica. Secundum editionem quintam	Initia rhetorica. Secundum editionem quintam	FALSE	Turku	1792
Kungliga	NA	Kuning:sen Maj:tin Placati Yhteisestä Walitus-Päiwästä, 	Kuning:sen Maj:tin Placati Yhteisestä Walitus-Päiwästä, Joka Korkeimasti Autuan Hänen Kuning:sen Maj:tinsä Kuningas Gustafwin III:nen Ruotzin, Göthin ja Wendin Kuningan &c. &c. &c. perillisen Norjaan ja Scheszwigin Hollsteinin Hertuan &c. &c. Korkeimasti Surullisen Kuolemanylitze yli koko Ruotzin Waldakunnan, Suuren Ruhtinan Maan Suomen ja kaikkein Ruotzin Kruunun alla olewain Ruhtinan Maitten, Maakundainja Herran Waldain, juhlallisesti pidettämän ja wietettämän pitä. Annettu Stockholmin Linnasa s. 4 p. Huhti-Kuusa 1792	FALSE	Turku	1792
Kungliga	Ignatius, Bengt Jacob (1761-1827)	Swea folks klagan och tröst, 	Swea folks klagan och tröst, wid en allmän olycka, en smärtande förlust, konung Gustaf den III:s död, förestälde i aftonsångs-predikan på Swea rikes allmänna klago-dag den 6 junii 1792. i Åbo dom-kyrka af Bengt Jacob Ignatius. Åbo, tryckt	FALSE	Turku	1792
Kungliga	Snellman, Johan Niclas (1769-1844)	Dissertatio academica, brevem conspectum oeconomiæ 	Dissertatio academica, brevem conspectum oeconomiæ Fennicæ usque ad tempora regis Gustavi I:mi, exhibens, quam cons. ampl. senat. philos. in Reg. Acad. Aboënsi, publico examini modeste subjiciunt Johan. Nicol. Snellman, phil. mag. et Henricus Vörlund, stipend. reg. Ostrobotnienses. In auditorio majori die XII Junii MDCCXCIII. H. a. m. c	NA	Turku	1793
Kungliga	Floderus, Johan (1721-1789)	Laudatio funebrus... Carolo Friedrico Mennander, 	Laudatio funebrus... Carolo Friedrico Mennander, ecclesiae Sveo-Gothicae archi-episcopo, ... dicta Upsaliae in auditorio Gustaviano majori die 1 maji Anni 1787	FALSE	Turku	1793
Kungliga	Lissander, Anders (1704-1786)	Maa-pärunain kassvattamisesta. Ulosannettu Anders Lissanderilda 	Maa-pärunain kassvattamisesta. Ulosannettu Anders Lissanderilda ... . Ja nyt suomexi käätty	FALSE	Turku	1793
Kungliga	Cavander, Christian (1730-1812)	Oratio funebris, qua... ecclesiae Svio-Gothicae 	Oratio funebris, qua... ecclesiae Svio-Gothicae archiepiscopi.	FALSE	Turku	1793
Kungliga	Alopaeus, Per Johan (1773-1814)	Specimen historiæ litterariæ fennicæ, cujus 	Specimen historiæ litterariæ fennicæ, cujus partem primam ... publice ventilandam sistunt Petrus Joh. Alopaeus, ... et Paulus Johannes Heintzius, Wiburgenses. In audit. maj. die IV. Dec. a. MDCCXCIII. Horis ante meridiem solitis	NA	Turku	1793
Kungliga	NA	Suprema pietatis munera, memoriæ viri, 	Suprema pietatis munera, memoriæ viri, dum viveret, reverendissimi atque eminentissimi, ecclesiæ sveo-gothicæ archi-episcopi, academiæ Upsaliensis pro-cancellarii ... Caroli Friderici Mennander, publice consecrata. Aboæ, typis Frenckellianis	FALSE	Turku	1793
Kungliga	Porthan, Henrik Gabriel (1739-1804)	Dissertatio academica, historiam Borgoæ urbis 	Dissertatio academica, historiam Borgoæ urbis Nylandiæ, leviter adumbrans: cujus partem priorem, ... præside mag. Henrico Gabriele Porthan ... publico examini subjiciet Magnus Alopaeus, Wiburgensis, in aud. maj. die XII. Nov. MDCCXCIV, horis a. m. solitis	NA	Turku	1794
