catalog	author	short_title	title	dissertation	publication_place	publication_year
Kungliga	Tengström, Jacob (1755-1832)	Om Ahlmanska sockne-skolarnes tjenligaste inrättning. 	Om Ahlmanska sockne-skolarnes tjenligaste inrättning. Svar på kongl. finska hushållnings- sällskapets prisfråga i detta ämne: af Jacob Tengström ... samt Jacob Bonsdorff ... Åbo, tryckte hos Joh. C. Frenckell, 1804	FALSE	Turku	1804
Kungliga	Bonsdorff, Gabriel Von (1762-1831)	Sammandrag af underrättelser, om sättet 	Sammandrag af underrättelser, om sättet att anlägga en köks-trägård för husbehof, och att deruti på ett för finska climatet lämpeligt sätt, frambringa åtskilliga matnyttiga växter, samt att dem till framtida bruk förwara och till gagns	FALSE	Turku	1804
Kungliga	NA	Testamentariska författningar om stipendier för 	Testamentariska författningar om stipendier för studerande vid kongl. academien i Åbo. Åbo, 1804. Tryckte hos Joh. Ch. Frenckell, på egen bekostnad	FALSE	Turku	1804
Kungliga	NA	Till allmänheten, redogörelse för kongl. 	Till allmänheten, redogörelse för kongl. finska hushållnings-sällskapets göromål, ifrån den 1 november år 1803, till samma tid år 1804. Åbo, tryckt hos Johan Ch. Frenckell	FALSE	Turku	1804
Kungliga	Hellens, Carl Niclas Von (1745-1820)	Anmärkningar rörande träd-planteringen	Anmärkningar rörande träd-planteringen	FALSE	Turku	1805
Kungliga	Hippokrates, 	Aphorismorum sectiones octo	Aphorismorum sectiones octo	FALSE	Turku	1805
Kungliga	Rousseau, Jean-jacques (1712-1778)	Emil eller om uppfostran	Emil eller om uppfostran	FALSE	Turku	1805
Kungliga	Rousseau, Jean Jacques (1712-1778)	Emil eller Om uppfostran. Af 	Emil eller Om uppfostran. Af J.J. Rousseau ... Öfversättning af J.W. Tuderus. Åbo. Tryckt hos J.C. Frenckell. =1. 1805=	FALSE	Turku	1805
Kungliga	Svebilius, Olof (1624-1700)	Enfaldig förklaring öfwer d. Martin 	Enfaldig förklaring öfwer d. Martin Lutheri lilla cateches, stäld genom spörsmål och swar, af Olao Svebilio ... Åbo, 1805. Tryckt hos Joh. C. Frenckell	FALSE	Turku	1805
Kungliga	Frenckell, Johan Christofer (1789-1844)	Förtekning på böcker och skrifter, 	Förtekning på böcker och skrifter, som jämte många andra finnas til salu hos Joh. C. Frenckell i Åbo, på boklådan vid Stora Kyrkogatan, dels häftade, dels i exemplar. =(Rubr.)= (Åbo tryckt i januarii 1805. Hos J.C. Frenckell.	FALSE	Turku	1805
Kungliga	Zerenner, Heinrich Gottlieb (1750-1811)	Kristlig religions-lärobok för lärare och 	Kristlig religions-lärobok för lärare och barn, jämte fem hufwudstycken i Luthers kateches med korrtta ordförklaringar af Heinrich Gottlieb Zerrenner. Öfwersatt med förändringar, tillökta förklaringar samt förbättrad swensk öfwersättning	FALSE	Turku	1805
Kungliga	NA	Kuning:sen Maj:tin Placati, Neljästä Yhteisestä, 	Kuning:sen Maj:tin Placati, Neljästä Yhteisestä, Julki- Kiitos- Paasto- Katumus- ja Rukous-Päiwästä, Jotka Yli koko Ruotzin Waldakunnan, Suuren Ruhtinan Maan Suomen, ja kaikkein Ruotzin Kruunun omain ja sen alla olewain Ruhtinan Maitten, Maakundain ja Herran Waldain, juhlallisesti pidettämän ja wietettämän pitä tulewana Wuonna 1806. Annettu Högkwarterisa Lyneburgin Linnasa sinä 26 päiwänä Joulu-Kuusa 1805	FALSE	Turku	1805
Kungliga	Darelli, Isak Af (1756-1834)	Några tankar vid herr Grewesmöhlens 	Några tankar vid herr Grewesmöhlens svar, om förmånligaste sättet att använda trädesjorden	FALSE	Turku	1805
Kungliga	NA	Till allmänheten, redogörelse, för kongl. 	Till allmänheten, redogörelse, för kongl. finska hushållnings-sällskapets göromål, ifrån den 1 november år 1804, till samma tid år 1805. Åbo, tryckt hos Johan Ch. Frenckell	FALSE	Turku	1805
Kungliga	Achrenius, Abraham (1706-1769)	Vanhat ja uudet hengelliset virret.	Vanhat ja uudet hengelliset virret.	FALSE	Turku	1805
Kungliga	Snellman, Henric (1780-1835)	De sensu juventutis æsthetico, in 	De sensu juventutis æsthetico, in legendis auctoribus classicis formando. Specim. acad. cujus partem I. venia ampl. fac. phil. Ab. publico proponit examini Henricus Snellman ... respondente Gust. Guilielm. Zetterberg, Jemtl. In schola cathedr. die 19 Junii 1806. Horis a. m. solitis	NA	Turku	1806
Kungliga	NA	Handlingar rörande framl. assessoren Gabriel 	Handlingar rörande framl. assessoren Gabriel Ahlmans testamente. Åbo 1806. Tryckt hos Joh. Christ. Frenckell	FALSE	Turku	1806
Kungliga	Salzmann, Christian Gotthilf (1744-1811)	Henrik Gottschalk i sin familj. 	Henrik Gottschalk i sin familj. Lärobok af C.G. Salzman. Öfversatt af Joh. Henr. Avellan. Åbo, 1806. Tryckt hos Joh. Chr. Frenckell	FALSE	Turku	1806
Kungliga	NA	Kongl. Maj:ts Allernådigste Instructiner för 	Kongl. Maj:ts Allernådigste Instructiner för De wid Kongl. Academien i Åbo, samt Cathedral-Skolan derstädes, inrättade Nya Underwisnings-anstalter; jemte Kongl. Maj:ts Allernådigste Författningar om Prest- och Pastoral-Examina i de Finska Stiften, Gifne Högqwarteret Greifswald den 14 Junii 1806	FALSE	Turku	1806
Kungliga	NA	Kongl. maj:ts nådiga tilläggningar uti 	Kongl. maj:ts nådiga tilläggningar uti infanterie-exercitie- reglementet. Greifswald, tryckt hos I.H. Eckhardt, 1806. På reqvisition gneom majoren och riddaren H.C. Reutersköld, för kongl. Åbo läns linie-regemente omtryckt i Åbo hos	FALSE	Turku	1806
Kungliga	NA	Kongl. Maj:ts Nådigst faststälde Brand-Ordning 	Kongl. Maj:ts Nådigst faststälde Brand-Ordning För Ekenäs stad: Gifwen Stockholms Slott den 2 martii 1801	FALSE	Turku	1806
Kungliga	Hartman, Gabriel Israel (1776-1809)	Lärobok i allmänna geografin, för 	Lärobok i allmänna geografin, för svenska barn. Af Gabr. Isr. Hartman. ... Åbo. Tryckt hos Johan Ch. Frenckell. =1. 1806.=	FALSE	Turku	1806
Kungliga	Hartman, Gabriel Israel (1776-1809)	Lärobok i allmänna geografin, för 	Lärobok i allmänna geografin, för svenska barn	FALSE	Turku	1806
Kungliga	Kiesewetter, J G C c (1744-1819)	Lärobok i logiken, af J.G.C.C. 	Lärobok i logiken, af J.G.C.C. Kiesewetter ... Öfversatt af J.W. Tuderus ... Åbo, 1806. Tryckt hos Johan Ch. Frenckell	FALSE	Turku	1806
Kungliga	NA	Om förposter. På requisition genom 	Om förposter. På requisition genom majoren och riddaren H.C. Reutersköld, för kongl. Åbo läns linie-regemente, omtryckt i Åbo hos J.C. Frenckell. 1806	FALSE	Turku	1806
Kungliga	Wallenius, Johan Fredric (1765-1836)	Sorge-tal öfver högtsalig hans kongl. 	Sorge-tal öfver högtsalig hans kongl. höghet storfursten af Finland Carl Gustaf: hållit, å kongl. akademiens i Åbo vägnar, den 7 november 1805, och på consistorii academici anmodan utgifvit, af Johan Fredric Wallenius ... Åbo, 1806	FALSE	Turku	1806
Kungliga	Avellan, Johan Henrik (1773-1832)	Specimen philosophicam anthropologiæ cognitionem idoneo 	Specimen philosophicam anthropologiæ cognitionem idoneo puerorum institutori necessariam sistens. Cujus particulam I venia ampl. facult. philos. Aboëns. publico examini submittent Johannes Henr. Avellan, philos. pract docens, et Gustavus Neclair, stip. reg. Tavastensis. In auditorio physico die XX Dec. MDCCCVI. H. a. m. s	NA	Turku	1806
Kungliga	NA	Till allmänheten, redogörelse för kongl. 	Till allmänheten, redogörelse för kongl. finska hushållnings-sällskapets göromål, ifrån den 1 november år 1805, till samma tid år 1806. Åbo, tryckt hos Johan Chr. Frenckell	FALSE	Turku	1806
Kungliga	NA	Uskon ja rakkauden silmäminen Herran 	Uskon ja rakkauden silmäminen Herran Jesuxen puoleen ristin päällä.	FALSE	Turku	1806
Kungliga	NA	Wastuutiset hengelliset wirret autuuden perustuxesta 	Wastuutiset hengelliset wirret autuuden perustuxesta ... Abraham Achrenius	FALSE	Turku	1806
Kungliga	NA	Åbo Stads Brand-Ordning, efter öfwerläggning 	Åbo Stads Brand-Ordning, efter öfwerläggning med wederbörande författad och af Kongl. Maj:t till obrottslig efterlefnad i nåder gillad och stadfästad den 29 october 1805	FALSE	Turku	1806
Kungliga	Wänman, Israel Gustaf (1762-1821)	Den sanna friheten, en skänk 	Den sanna friheten, en skänk af Jesu religion, föreställd uti en predikan i anledning af 1 Cor. 7: v. 23, wid prestmötet i Åbo, den 18 sept. 1807, af Israel Gustaf Wänman ... På begäran till trycket lemnad. Åbo, tryckt hos J.C. Frenckell	FALSE	Turku	1807
Kungliga	Lafontaine, August Heinrich Julius (1758-1831)	Emeritus. Pendant till den fattiga 	Emeritus. Pendant till den fattiga landt-prästen; af August Lafontaine. Öfversättning af G.A. Schöring. Åbo. Tryckt hos Johan C. Frenckell. =1. 1807=	FALSE	Turku	1807
Kungliga	Frenckell, Johan Christofer (1789-1844)	Förtekning på böcker och skrifter, 	Förtekning på böcker och skrifter, som jämte många andra finnas till salu hos Joh. C. Frenckell i Åbo, på boklådan vid Stora Kyrkogatan, dels häftade, dels i exemplar. =(Rubr.)= (Åbo, tryckt i martii månad 1807. [J.C. Frenckell.] 	FALSE	Turku	1807
Kungliga	NA	Kongl. finska hushållnings-sällskapets handlingar. =Åbo. 	Kongl. finska hushållnings-sällskapets handlingar. =Åbo. 1-3. 1803-1819=. 8:o [3:	FALSE	Turku	1807
Kungliga	NA	Kuning:sen Maj:tin Placati, Neljästä Yhteisestä, 	Kuning:sen Maj:tin Placati, Neljästä Yhteisestä, Julki- Kiitos- Paasto- Katumus- ja Rukous-Päiwästä, Jotka Yli koko Ruotzin Waldakunnan, Suuren Ruhtinan Maan Suomen, ja kaikkein Ruotzin Kruunun omain ja sen alla olewain Ruhtinan Maitten, Maakundain ja Herran Waldain, juhlallisesti pidettämän ja wietettämään pitää tulewana Wuonna 1808. Annettu Stockholmin Linnasa sinä 23 päiwänä Joulu-Kuusa 1807	FALSE	Turku	1807
Kungliga	Hartman, Gabriel Israel (1776-1809)	Kunskapslära	Kunskapslära	FALSE	Turku	1807
Kungliga	NA	Protokoll hållit vid prestmötet i 	Protokoll hållit vid prestmötet i Åbo .	FALSE	Turku	1807
Kungliga	Lenz, Christian David (1720-1798)	Styrkan af skriftenes bewis för 	Styrkan af skriftenes bewis för den wigtiga läran om Jesu Christi tilfyllestgörelse, korteligen förestäld och på begäran 1780 utgifwen, af Christian David Lenz ... Öfwersättning af C.U.W. Å nyo uplagd och med företal försedt af And	FALSE	Turku	1807
Kungliga	NA	Till allmänheten, redogörelse för kongl. 	Till allmänheten, redogörelse för kongl. finska hushållnings-sällskapets göromål, ifrån den 1 nov. år 1806 till samma tid år 1807. Åbo, tryckt hos Johan Chr. Frenckell	FALSE	Turku	1807
Kungliga	NA	Underrättelser från kongl. finska hushållnings 	Underrättelser från kongl. finska hushållnings sällskapet. =Åbo. 1-9. 1807-19.=	FALSE	Turku	1807
Kungliga	NA	Underrättelser från kongl. finska hushållnings 	Underrättelser från kongl. finska hushållnings sällskapet. =Åbo. 1-9. 1807-19.=	FALSE	Turku	1807
Kungliga	Tolpo, Nils Magnus (1770-1853)	Åbo stifts matrikel. Utgifven af 	Åbo stifts matrikel. Utgifven af Nils M. Tolpo ... Åbo, 1807. Tryckt hos J.C. Frenckell	FALSE	Turku	1807
Kungliga	NA	A a b c ... 	A a b c ... å ä ö. ff ll r s sk sl ss st sz tz v. A B C ... Å Ä Ö. a b c ... å ä ö. ct & ff s ss v æ . A B C ... Å Ä Ö. N:o 1 2 ... 9 10. Sjelfljudande bokstäfwer äro 9: a e ... ä ö. Medljudande bokstäfwer äro 19: b c ... x z. (Åbo	FALSE	Turku	1808
Kungliga	NA	ABC-bok.	ABC-bok.	FALSE	Turku	1808
Kungliga	NA	Alexander I Wi Alexander den 	Alexander I Wi Alexander den förste med Guds nåde kejsare och sjelfregerande alla ryszar &c. &c. &c. =(Rubr.) S. impr.=	FALSE	Turku	1808
Kungliga	NA	Allmän kungörelse: =(Rubr.) S. impr.=	Allmän kungörelse: =(Rubr.) S. impr.=	FALSE	Turku	1808
Kungliga	NA	Allmän kungörelse: =(Rubr.) S. impr.=	Allmän kungörelse: =(Rubr.) S. impr.=	FALSE	Turku	1808
Kungliga	NA	Allmän kungörelse: =(Rubr.) S. impr.=	Allmän kungörelse: =(Rubr.) S. impr.=	FALSE	Turku	1808
Kungliga	Ahlstedt, Johan Fredric (1776-1823)	Contoirs-almanach, för året efter frälsarens 	Contoirs-almanach, för året efter frälsarens Christi födelse 1809. Till Åbo horizont. På befallning utgifwen och upplagd af Johan Fredric Ahlstedt. Åbo, tryckt, enligt skriftelig befallning, hos J.C. Frenckell. [1808.	FALSE	Turku	1808
Kungliga	Wallenius, Johan Fredric (1765-1836)	Dissertatio academica de etymologiis Ciceronis	Dissertatio academica de etymologiis Ciceronis	FALSE	Turku	1808
Kungliga	NA	Dom i målet emellan öfver-directeuren 	Dom i målet emellan öfver-directeuren Bremer, dess söner och mågar, å ena, och handl	FALSE	Turku	1808
Kungliga	Svebilius, Olof (1624-1700)	Enfaldig förklaring öfwer d. Martin 	Enfaldig förklaring öfwer d. Martin Lutheri lilla cateches, stäld genom spörsmål och swar, af Olao Svebilio ... Åbo, 1808. Tryckt hos Joh. C. Frenckell	FALSE	Turku	1808
Kungliga	NA	Finska hushållnings-sällskapet, den 1 november 	Finska hushållnings-sällskapet, den 1 november 1808. Åbo, tryckt hos Johan Chr. Frenckell	FALSE	Turku	1808
Kungliga	NA	Henriette Dufort. En målning ur 	Henriette Dufort. En målning ur franska revolutions historien. Öfversatt af N.P. Hulthin. Åbo, 1808. Tryckt hos J.C. Frenckell	FALSE	Turku	1808
Kungliga	Salzmann, Christian Gotthilf (1744-1811)	Henrik Gottschalk i sin familj	Henrik Gottschalk i sin familj	FALSE	Turku	1808
Kungliga	Snell, J F A	Hyviä tapoja opettavaiset jutut yhteiselle 	Hyviä tapoja opettavaiset jutut yhteiselle kansalle ja lapsille	FALSE	Turku	1808
Kungliga	NA	Kungörelse. =(Rubr.) S. impr.=	Kungörelse. =(Rubr.) S. impr.=	FALSE	Turku	1808
Kungliga	NA	Kungörelse. =(Rubr.) S. impr.=	Kungörelse. =(Rubr.) S. impr.=	FALSE	Turku	1808
Kungliga	NA	Kungörelse. =(Rubr.) S. impr.=	Kungörelse. =(Rubr.) S. impr.=	FALSE	Turku	1808
Kungliga	NA	Kungörelse. =(Rubr.) S. impr.=	Kungörelse. =(Rubr.) S. impr.=	FALSE	Turku	1808
Kungliga	NA	Kungörelse. =(Rubr.) S. impr.=	Kungörelse. =(Rubr.) S. impr.=	FALSE	Turku	1808
Kungliga	NA	Kungörelse. =(Rubr.) S. impr.=	Kungörelse. =(Rubr.) S. impr.=	FALSE	Turku	1808
Kungliga	NA	Kungörelse. =(Rubr.) S. impr.=	Kungörelse. =(Rubr.) S. impr.=	FALSE	Turku	1808
Kungliga	NA	Kungörelse. =(Rubr.) S. impr.=	Kungörelse. =(Rubr.) S. impr.=	FALSE	Turku	1808
Kungliga	NA	Kungörelse. =(Rubr.) S. impr.=	Kungörelse. =(Rubr.) S. impr.=	FALSE	Turku	1808
Kungliga	NA	Kungörelse. =(Rubr.) S. impr.=	Kungörelse. =(Rubr.) S. impr.=	FALSE	Turku	1808
Kungliga	NA	Kungörelse. =(Rubr.) S. impr.=	Kungörelse. =(Rubr.) S. impr.=	FALSE	Turku	1808
Kungliga	NA	Kungörelse. =(Rubr.) S. impr.=	Kungörelse. =(Rubr.) S. impr.=	FALSE	Turku	1808
Kungliga	NA	Kungörelse. =(Rubr.) S. impr.=	Kungörelse. =(Rubr.) S. impr.=	FALSE	Turku	1808
Kungliga	NA	Kungörelse. =(Rubr.) S. impr.=	Kungörelse. =(Rubr.) S. impr.=	FALSE	Turku	1808
Kungliga	NA	Kungörelse. =(Rubr.) S. impr.= 1/8:o 	Kungörelse. =(Rubr.) S. impr.= 1/8:o =el=	FALSE	Turku	1808
Kungliga	Hartman, Gabriel Israel (1776-1809)	Kunskapslära. Ett försök till framställning 	Kunskapslära. Ett försök till framställning af vettenskapen om kunskapens grunder, lynne och värde. Af Gabriel Israel Hartman ... Åbo. Tryckt hos Johan Ch. [2:] Chr. Frenckell. =1-2. 1807-1808.=	FALSE	Turku	1808
Kungliga	Ramus, Jonas (1649-1718)	Lyhy ja arvamatoin armon-aika .	Lyhy ja arvamatoin armon-aika .	FALSE	Turku	1808
Kungliga	Ovidius Naso, Publius	Metamorphoseon libri XV	Metamorphoseon libri XV	FALSE	Turku	1808
Kungliga	NA	Proclamation. =(Rubr.) S. impr.=	Proclamation. =(Rubr.) S. impr.=	FALSE	Turku	1808
Kungliga	NA	Proclamation. =(Rubr.) S. impr.=	Proclamation. =(Rubr.) S. impr.=	FALSE	Turku	1808
Kungliga	NA	Proclamation. =(Rubr.)= =S. impr.=	Proclamation. =(Rubr.)= =S. impr.=	FALSE	Turku	1808
Kungliga	NA	Publication. =(Rubr.) S. impr.=	Publication. =(Rubr.) S. impr.=	FALSE	Turku	1808
Kungliga	NA	Publication. =(Rubr.) S. impr.=	Publication. =(Rubr.) S. impr.=	FALSE	Turku	1808
Kungliga	NA	Samling af placater, förordningar, manifester 	Samling af placater, förordningar, manifester och påbud, samt andre allmänna handlingar, hwilka i stor-furstendömet Finland sedan 1808 års början ifrån trycket utkommit. Med hans kejserlige maj:ts allernådigste tillstånd. Åbo, tryckt	FALSE	Turku	1808
Kungliga	NA	Till allmänheten redogörelse för finska 	Till allmänheten redogörelse för finska hushållnings- sällskapets göromål, ifrån den 1 nov. år 1807 till samma tid år 1808. Åbo, tryckt hos Johan Chr. Frenckell	FALSE	Turku	1808
Kungliga	NA	Underrättelser från kongl. finska hushållnings 	Underrättelser från kongl. finska hushållnings sällskapet. =Åbo. 1-9. 1807-19.=	FALSE	Turku	1808
Kungliga	NA	Almanach, för året efter frälsarens 	Almanach, för året efter frälsarens Christi födelse 1810. Till Åbo horizont, belägen 60 grader 27 minuter norr om equatoren, samt 19 gr. 58 m. öster om pariser-observatorium. På hög befallning utgifwen af kejserliga academien i Åbo	FALSE	Turku	1809
Kungliga	Tengström, Jacob (1755-1832)	Berättelse om landtdagen i Borgo, 	Berättelse om landtdagen i Borgo, till det högwördige preste ståndets ledamöter af Åbo och Borgo stift. =(Rubr.)=/(J. Tengström.) (Åbo, tryckt hos J.C. Frenckell 1809.	FALSE	Turku	1809
Kungliga	NA	Freds fördrag emellan hans maj:t 	Freds fördrag emellan hans maj:t kejsaren af Ryszland och hans maj:t konungen af Swerige, afhandladt och slutit i Fredricshamn, den 5/17 september 1809, och ratificeradt i St. Petersburg den 1/13 october. Åbo, tryckt hos J.C. Frenckell	FALSE	Turku	1809
Kungliga	Alexander,  (1777-1825)	Hans kejserliga majestäts Alexander I:s 	Hans kejserliga majestäts Alexander I:s Tal, hållet wid landtdagens slut, i Borgå, den 6/18 julii 1809. Åbo, tryckt hos mag. J.C. Frenckell	FALSE	Turku	1809
Kungliga	Alexander,  (1777-1825)	Hans kejserliga majestäts Alexander I:s 	Hans kejserliga majestäts Alexander I:s Tal, hållet wid hyllningen i Borgå, den 17/29 martii 1809. Åbo, tryckt hos mag. J.C. Frenckell	FALSE	Turku	1809
Kungliga	NA	Hans kejserliga majestäts nådiga försäkran, 	Hans kejserliga majestäts nådiga försäkran, till samtelige Finlands inbyggare; gifwen Borgå, den 15/27 martii 1809. Åbo, tryckt hos mag. J.C. Frenckell	FALSE	Turku	1809
Kungliga	NA	Hans kejserliga majestäts nådiga kungörelse, 	Hans kejserliga majestäts nådiga kungörelse, till samtelige Finlands inbyggare; gifwen Borgå den 23 martii/4 april 1809. Åbo, tryckt hos mag. J.C. Frenckell	FALSE	Turku	1809
Kungliga	NA	Kejserliga finska hushållnings-sälskapet, den 1 	Kejserliga finska hushållnings-sälskapet, den 1 november 1809. Åbo, tryckt hos Johan Chr. Frenckell	FALSE	Turku	1809
Kungliga	NA	Läsning i tyska språket. Utgifven 	Läsning i tyska språket. Utgifven af And. Joh. Rönnbäck. Åbo. Tryckt hos J.C. Frenckell. =1. 1809=	FALSE	Turku	1809
Kungliga	Radloff, Fredrik Wilhelm	Muthmassungen über den Ursprung des 	Muthmassungen über den Ursprung des finnischen Volks	FALSE	Turku	1809
Kungliga	NA	Samling af de till efterlefnad 	Samling af de till efterlefnad gällande bref, förklaringar och föreskrifter, hwilka af hans kejserl. maj:t, äfwensom ifrån expeditionerne i desz senat för stor-furstendömet Finland blifwit utfärdade uti justitiæ-oeconomiæ- och politiæ	FALSE	Turku	1809
Kungliga	NA	Till allmänheten redogörelse för kejserliga 	Till allmänheten redogörelse för kejserliga finska hushållnings-sällskapets göromål, ifrån den 1 nov. år 1808 till samma tid år 1809. Åbo, tryckt hos Johan Chr. Frenckell	FALSE	Turku	1809
Kungliga	NA	Underrättelser från kongl. finska hushållnings 	Underrättelser från kongl. finska hushållnings sällskapet. =Åbo. 1-9. 1807-19.=	FALSE	Turku	1809
Kungliga	Bunyan, John (1628-1688)	Yhden Kristityn vaellus .	Yhden Kristityn vaellus .	FALSE	Turku	1809
Kungliga	NA	Almanach, för året efter frälsarens 	Almanach, för året efter frälsarens Christi födelse 1811. Till Åbo horizont, belägen 60 grader 27 minuter norr om equatorn, samt 19 gr. 58 m. öster om pariser-observatorium. Utgifwen, efter hans kejserl. maj:ts nådiga förordnande, af	FALSE	Turku	1810
Kungliga	Bonsdorff, Johan (1772-1840)	De virtute Mahumedis, aquam ex 	De virtute Mahumedis, aquam ex arena vel petra eliciendi	TRUE	Turku	1810
Kungliga	NA	Finlands stats-calender för året 1811. 	Finlands stats-calender för året 1811. Till Åbo horizont, belägen 60 grader 27 minuter norr om equatorn, samt 19 gr. 58 min. öster om Pariser-observatorium. Utgifven, efter hans kejserl. maj:ts nådigste förordnande, af dess academie	FALSE	Turku	1810
Kungliga	Frenckell, Johan Christofer (1789-1844)	Förtekning på böcker och skrifter, 	Förtekning på böcker och skrifter, som jämte många andra finnas till salu hos Joh. C. Frenckell i Åbo, på boklådan vid Stora Kyrkogatan, dels häftade, dels i exemplar. =(Rubr.)= (Åbo tryckt i martii månad 1810.) [J.C. Frenckell.	FALSE	Turku	1810
Kungliga	NA	Kejserliga finska hushållnings-sällskapet, den 1 	Kejserliga finska hushållnings-sällskapet, den 1 november 1810. Åbo, tryckt hos Johan Chr. Frenckell	FALSE	Turku	1810
Kungliga	Borgström, Gabriel (1784-1839)	Knekt för växlingen af ryskt- 	Knekt för växlingen af ryskt- och svenskt silfver- och sedel-mynt: uprättad i enlighet med hans kejserlige majestäts nådiga förordning af d. 17/29 december 1809. På befallning uträknad af G. Borgström. ... Åbo, tryckt hos J.C. Frenckell	FALSE	Turku	1810
Kungliga	Franzén, Frans Michael (1772-1847)	Skaldestycken af Frans M. Franzén. 	Skaldestycken af Frans M. Franzén. Åbo, tryckt hos Joh. Ch. Frenckell. =1. 1810=	FALSE	Turku	1810
Kungliga	NA	Till allmänheten redogörelse för kejserliga 	Till allmänheten redogörelse för kejserliga finska hushållnings-sällskapets göromål, ifrån den 1 nov. år 1809 till samma tid år 1810. Åbo, tryckt hos Johan Chr. Frenckell	FALSE	Turku	1810
Kungliga	Eckerberg, Johan Gustaf (1776-1808)	A.B.C. bok af Joh. Gustaf 	A.B.C. bok af Joh. Gustaf Eckerberg. Ny upplaga i sammandrag. Åbo, 1811. Tryckt hos Joh. Christ. Frenckell	FALSE	Turku	1811
Kungliga	NA	Afhandling om circulations-bruks antaglighet i 	Afhandling om circulations-bruks antaglighet i Finland. Till svar på kejserliga finska hushållnings-sällskapets d. 1 nov. 1808 utgifne fråga. Åbo 1811 tryckt hos Johan Christ. Frenckell	FALSE	Turku	1811
Kungliga	NA	Almanach, för skott-året efter frälsarens 	Almanach, för skott-året efter frälsarens Christi födelse 1812. Till Åbo horizont, belägen 60 grader 27 minuter norr om equatorn, samt 19 gr. 58 m. öster om pariser-observatorium. Utgifwen, efter hans kejserl. maj:ts nådiga förordnande	FALSE	Turku	1811
Kungliga	NA	Finlands stats-calender för skott-året 1812. 	Finlands stats-calender för skott-året 1812. Till Åbo horizont, belägen 60 grader 27 minuter norr om equatorn, samt 19 gr. 58 min. öster om Pariser-observatorium. Utgifven, efter hans kejserl. maj:ts nådigste förordnande, af dess academie	FALSE	Turku	1811
Kungliga	NA	Finska hushållningssällskapet, den 1 November 	Finska hushållningssällskapet, den 1 November 1811. [Matrikel.	FALSE	Turku	1811
Kungliga	Frenckell, Johan Christofer (1789-1844)	Förtekning på böcker och skrifter, 	Förtekning på böcker och skrifter, som jämte många andra finnas till salu hos Joh. C. Frenckell i Åbo, på boklådan vid Stora Kyrkogatan, dels häftade, dels i exemplar. =(Rubr.)= (Åbo tryckt i martii månad 1811.) [J.C. Frenckell.	FALSE	Turku	1811
Kungliga	NA	Gränse-reglerings-tractat emellan hans majestät kejsaren 	Gränse-reglerings-tractat emellan hans majestät kejsaren af Ryszland, och hans majestät konungen af Swerige, afsluten i Torneå den 8/20 november 1810. Acte de demarcation conclu entre sa majesté l'empereur de toutes les Russies & sa	FALSE	Turku	1811
Kungliga	NA	Kejserliga finska hushållnings-sällskapet, den 1 	Kejserliga finska hushållnings-sällskapet, den 1 november 1811. Åbo, tryckt hos Johan Chr. Frenckell	FALSE	Turku	1811
Kungliga	NA	Orationes panegyricæ, quibus in euergetam 	Orationes panegyricæ, quibus in euergetam summum, potentissimum Alexandrum primum, Rossiarum omnium imperatorem ... pietatem suam, diebus XXVII et XXVIII MDCCCXI, testatam fecit Academia Aboensis	FALSE	Turku	1811
Kungliga	Snellman, Henric (1780-1835)	Tal vid den högtidlighet, hvarmed 	Tal vid den högtidlighet, hvarmed kejserl. akademien i Åbo, den 28 junii 1811, firade stiftelsen af den henne allernådigst beviljade nya stat, hållit af Henric Snellman ... Åbo 1811, tryckt hos J.C. Frenckell	FALSE	Turku	1811
Kungliga	NA	Almanach, för året efter frälsarens 	Almanach, för året efter frälsarens Christi födelse 1813. Till Åbo horizont, belägen 60 grader 27 minuter norr om equatorn, samt 19 gr. 58 m. öster om pariser-observatorium. Utgifwen, efter hans kejserl. maj:ts nådigste förordnande	FALSE	Turku	1812
Kungliga	NA	Catalogus librorum, quos possedit b.m. 	Catalogus librorum, quos possedit b.m. vir Henr. Gabr.Porthan,.	FALSE	Turku	1812
Kungliga	Wallenius, Johan Fredric (1765-1836)	Dissertatio academica historiam descriptionemque paroeciæ 	Dissertatio academica historiam descriptionemque paroeciæ Mändyharju sistens	TRUE	Turku	1812
Kungliga	NA	Finlands stats-calender för året 1813. 	Finlands stats-calender för året 1813. Till Åbo horizont, belägen 60 grader 27 minuter norr om equatorn, samt 19 gr. 58 min. öster om Pariser-observatorium. Utgifven, efter hans kejserl. maj:ts nådigste förordnande, af dess academie	FALSE	Turku	1812
Kungliga	Frenckell, Johan Christofer (1789-1844)	Förtekning på böcker och skrifter, 	Förtekning på böcker och skrifter, som jämte många andra finnas till salu hos Joh. C. Frenckell i Åbo, på boklådan vid Stora Kyrkogatan, dels häftade, dels i exemplar. =(Rubr.)= (Åbo tryckt i februari månad 1812.) [J.C. Frenckell.	FALSE	Turku	1812
Kungliga	NA	Kejserliga finska hushållnings-sällskapet, den 1 	Kejserliga finska hushållnings-sällskapet, den 1 november 1812. Åbo, tryckt hos Johan Chr. Frenckell	FALSE	Turku	1812
