catalog	author	short_title	title	dissertation	publication_place	publication_year
Kungliga	NA	Elenchus lectionum publicarum, quas professores 	Elenchus lectionum publicarum, quas professores in Regia Academia ad Auram singuli, ... a labentis anni, MDCLXXXIX. feriarum canicularium fine, ad earundem, anno sequenti, initium juventuti academicæ constituerunt proponere: rectore	FALSE	Turku	1689
Kungliga	Kexlerus, Andreas Simonis (1600-NA)	En christeligh predijkan, öfwer altarens 	En christeligh predijkan, öfwer altarens sacramente Herrans nattward: .	FALSE	Turku	1689
Kungliga	Gezelius, Johannes (1615-1690)	Index librorum & tractatuum &c. 	Index librorum & tractatuum &c. &c.	FALSE	Turku	1689
Kungliga	Comenius, Johann Amos (1592-1670)	Johannis Amos Comenii Orbis sensualium 	Johannis Amos Comenii Orbis sensualium pictus	FALSE	Turku	1689
Kungliga	Gezelius, Johannes (1647-1718)	Jubilæus antichristi romani ipsius exitium	Jubilæus antichristi romani ipsius exitium	FALSE	Turku	1689
Kungliga	NA	Elenchus lectionum publicarum, qvas professores, 	Elenchus lectionum publicarum, qvas professores, in Regia Academia Aboënsi, ... â labentis anni MDCLXXXX. dierum canicularium fine, ad eorundem, anno seqventi, initium, juventuti academicæ proponere receperunt: rectore Petro Hahn	FALSE	Turku	1690
Kungliga	Carpzov, Johann Benedikt (1607-1657)	Hodegeticum concionatorium, olim concinnatum à 	Hodegeticum concionatorium, olim concinnatum à Joh. Benedicto Carpzovio .	FALSE	Turku	1690
Kungliga	Gezelius, Johannes (1615-1690)	In textus poenitentiales quatuor dierum 	In textus poenitentiales quatuor dierum solemnium precum anni 1690	FALSE	Turku	1690
Kungliga	Achrelius, Daniel (1644-1692)	Laus manus. ... En kleen 	Laus manus. ... En kleen och subtiligh hand .	FALSE	Turku	1690
Kungliga	Possel, Johann (1528-1591)	Oikeion dialogon biblion .	Oikeion dialogon biblion .	FALSE	Turku	1690
Kungliga	Uggla, Claes (1670-1727)	Oratio, coronam virtutum justitiam, leni 	Oratio, coronam virtutum justitiam, leni penicillo adumbrans	FALSE	Turku	1690
Kungliga	Achrelius, Daniel (1644-1692)	Prophetens Daniels vthlägning öfwer konungens 	Prophetens Daniels vthlägning öfwer konungens i Assyrien Nebucadnesars dröm, som står beskrefwen i desz prophietes 2. cap. jämwähl hans egen syn, som finnes i det 7. cap. I swensk vers dhe vnga til tienst affsatt som historiske handlingar begynna på att skatta, aff Daniel Achrelio	FALSE	Turku	1690
Kungliga	Wanochius, Andreas Jacobi (1700-NA)	Disqvisitiones practicæ, qva thesin, antithesin, 	Disqvisitiones practicæ, qva thesin, antithesin, & axiomata, ita exhibitæ ut præter exempla, tum sacra, tum profana ... multæ etiam controversiæ ... pro re nata enodentur:	FALSE	Turku	1691
Kungliga	Lund, David (1657-1729)	Literarum humaniorum seriis cultoribus et 	Literarum humaniorum seriis cultoribus et admiratoribus sinceris,	FALSE	Turku	1691
Kungliga	Lilliegren, Efraim Axelsson (1668-1729)	Urbis inclytæ ac memorabilis Narvæ, 	Urbis inclytæ ac memorabilis Narvæ, ortus, situs, ædificia, vicissitudines, restaurationum gradus adeoqve hodierna fata, circa religionem justitiam, disciplinam militarem, ac commercia	FALSE	Turku	1691
Kungliga	Flachsenius, Johannes Henrici (1636-1708)	Chronologia sacra ...	Chronologia sacra ...	FALSE	Turku	1692
Kungliga	Achrelius, Daniel (1644-1692)	Danielis Achrelii Moralia, eller Några 	Danielis Achrelii Moralia, eller Några korta regler, hwar efter alla rättsinige jämwäl til dygd och ährbarheet artade ädlingar, som ni upwäxa til Gudz ähra, Kungl. Maij:tz tienst, och fäderneslandetz nytta; sitt lefwerne kunna styra, (om dem så behagar.) .	FALSE	Turku	1692
Kungliga	Achrelius, Daniel (1644-1692)	Den stoora monarkens öfwer Ægypten 	Den stoora monarkens öfwer Ægypten konung Pharaos namnkunnige rådz-herres patriarchens Josephs politie: i korta werszer beskrefwen af Daniel Achrelio .	FALSE	Turku	1692
Kungliga	NA	Elenchus lectionum publicarum, qvas professores, 	Elenchus lectionum publicarum, qvas professores, in Regia Academia Aboënsi, a præteritis diebus canicularibus, anni labentis MDCXCII. ad eorundem fere initium anni seqventis, durante interea rectoratu Matthiæ Swederi	FALSE	Turku	1692
Kungliga	NA	Genesis hebraice cum nov a 	Genesis hebraice cum nov a versione latina	FALSE	Turku	1692
Kungliga	Paulinus, Simon (1652-1691)	Simonis Paulini ... Grammatica hebræa	Simonis Paulini ... Grammatica hebræa	FALSE	Turku	1692
Kungliga	Achrelius, Daniel (1644-1692)	Verborum latini sermonis differentiæ in 	Verborum latini sermonis differentiæ in memoriale schediasma contractæ per Danielem Achrelium	FALSE	Turku	1692
Kungliga	Gezelius, Johannes (1615-1690)	Fasciculus homileticarum dispositionum annis circiter 	Fasciculus homileticarum dispositionum annis circiter XXVII. seorsim editarum: videlicet CCXX. in textus sacros poenitentiales. Et V. in totidem textus sollenn. grat. act. Accedunt nunc quoque XIII. homiliæ juridicæ:	FALSE	Turku	1693
Kungliga	Rotterdam, Erasmus (1469-1536)	Libellus aureus de civilitate morum 	Libellus aureus de civilitate morum puerilium, olim a des. Erasmo Roterodamo conscriptus, nunc vero cum idiomate svetico, in usum scholarum et pædagogiorum, denuo editus .	FALSE	Turku	1693
Kungliga	NA	Käsi-kiria, josa käsitetty on, cuinga 	Käsi-kiria, josa käsitetty on, cuinga jumalan-palwelus, christillisten ceremoniain ja kircon-menoin cansza, .	FALSE	Turku	1694
Kungliga	NA	Käsi-kiria, josa käsitetty on, cuinga 	Käsi-kiria, josa käsitetty on, cuinga jumalan-palwelus, christillisten ceremoniain ja kircon-menoin cansza, .	FALSE	Turku	1694
Kungliga	Munster, Johan Bernhard	Magnalia Gustavi primi, magni illius 	Magnalia Gustavi primi, magni illius Svecor	TRUE	Turku	1694
Kungliga	Gezelius, Johannes (1615-1690)	B. doct. Johannis Gezelii ... 	B. doct. Johannis Gezelii ... Synopsis logica, XVII. disputationibus publicè proposita, et ad multorum vota notis & exemplis sufficienter illustrata & in lucem edita, curâ & studio Simonis Tålpo ... cum gratia & privilegio S. R: M:tis	FALSE	Turku	1695
Kungliga	Lauremberg, Peter (1585-1639)	Petri Laurenbergii Chronius, sive Historiæ 	Petri Laurenbergii Chronius, sive Historiæ universalis epitome. Olim in academia Rostochiensi ab eodem proposita. Nunc vero continuata. Â Johanne Herbinio illustrata, & triplici praxi: didacticâ, polemicâ & axiomaticâ aucta. Cui operi nunc nomina regum Sveciæ cum nonnullis eorum gestis, ex historia Loccenii. Delineatio historiæ synoptica & tabulæ chronologicæ ex historia universali Hartnaccii. Item nomina regum, trib. mil. & consulum romanorum, ex fastis consularibus Caroli Sigonii, addita sunt	FALSE	Turku	1695
Kungliga	Alanus, Carolus Nicolai (1600-NA)	Sermo encomiasticus	Sermo encomiasticus	FALSE	Turku	1695
Kungliga	Petri, Laurentius (1671-1573)	Synopsis chronologiæ finnonicæ, rythmica eli 	Synopsis chronologiæ finnonicæ, rythmica eli ajan tieto, Suomenmaan menoist ja vscost, erinomaisest Suomen pispoist cungin kuningan ajall, lyhykäisijn rijmein coottu	FALSE	Turku	1695
Kungliga	NA	Catechismus wirsixi tehty	Catechismus wirsixi tehty	FALSE	Turku	1696
Kungliga	Chytraeus, Nathan (1543-1598)	Grammatica latina. .	Grammatica latina. .	FALSE	Turku	1696
Kungliga	Gezelius, Johannes (1647-1718)	Om hunger och dyyr tijdh, 	Om hunger och dyyr tijdh, trenne predikningar: sampt en om tacksäjelse til Gudh, tä han wälsignar åhret	FALSE	Turku	1696
Kungliga	Laurbecchius, Petrus Laurentii (1628-1705)	Diaskepsis de causis salutis humanæ, 	Diaskepsis de causis salutis humanæ, .	FALSE	Turku	1697
Kungliga	Hasselquist, Andreas Benedicti (1646-1700)	Lumen de lumine sparsum ... 	Lumen de lumine sparsum ... seu vera et gnesíos christiana religio: qvam qvoad ejusdem essentiam, proprietates, summam atqve opposita, sub decade disputationum theologicarum, in Regiâ acad. Aboënsi publicè habitarum, ex lumine lucido verbo dei, orthodoxorum theologorum ac patrum scriptis, qvibus, heterodoxorum contrariis opinionibus semper observatis, evictum, unicè salvificam esse Lutheranam novâ & artificiosâ methodo illustravit M. Andreas B. Haszelqwist, calm. S. S. theologiæ .	FALSE	Turku	1697
Kungliga	Comenius, Johann Amos (1592-1670)	Johannis Amos Comenii Orbis sensualium 	Johannis Amos Comenii Orbis sensualium pictus; In quo res omnes sensibus expositæ, singularibus schematibus depinguntur, & nativis vocabulis ita describuntur: adeo ut nomenclatura prima dici mereatur, cum versione sueca tertio editus.	FALSE	Turku	1698
Kungliga	NA	Wij, Gabriel Falckenberg, Kongl. May:tz 	Wij, Gabriel Falckenberg, Kongl. May:tz Råd och Præsident, uti den Kongl. Hoff-Rätt, i Stoor-Furstendömet Fin-Land ... at så wäl lagwundne Tiufwars, som deras Straf på Plichte-Pallen, hwilcka sig med lönskeläger försee .	FALSE	Turku	1698
Kungliga	NA	Wij, Gabriel Falckenberg, Kongl. May:tz 	Wij, Gabriel Falckenberg, Kongl. May:tz Råd och Præsident, uti den Kongl. Hof-Rätt i Stoor-Furstendömet Finland ... Emedan Kongl. Maij:tz Kyrkckiolag ey utnemner ett wist straff, angående dhe Encklingar eller Enckior, som twärt emot högstbemälte Kyrkckiolagz 15. Cap. och 17. §. flyttia tilsammans uti ett Bolag .	FALSE	Turku	1698
Kungliga	NA	Wij, Gabriel Falckenberg, Kongl. Maytz 	Wij, Gabriel Falckenberg, Kongl. Maytz Råd och Præsident, uti den Kongl. Hof-Rätt i Stoor-Furstendömet Finland ... at dhe Fångar, som för deras begångne Miszgiärningar, uthi Cronones Häckte i Landzorterne blifwa insatte, och aflijda genom Döden, innan som, efter föregången behörig Ransakning .	FALSE	Turku	1698
Kungliga	NA	Wij, Gabriel Falckenberg, Kongl. Maytz 	Wij, Gabriel Falckenberg, Kongl. Maytz Råd och Præsident, uti den Kongl. Hof-Rätt, i Stoor-Furstendömet Finland ... at Hereds Rätterne ey skola sig befatta med sådane Twister, som härröra af Kongl. Maij:tz Räntors inkräfwiande och Upbörd .	FALSE	Turku	1698
Kungliga	NA	Wij, Gabriel Falckenberg, Kongl. Maytz 	Wij, Gabriel Falckenberg, Kongl. Maytz Råd och Præsident, uti den Kongl. Hof-Rätt i Stoor-Furstendömet Finland ... at dubbelt Hoor ey blifwer hos alle Kongl. May:tz Öfwerdomare lijka afstraffadt .	FALSE	Turku	1698
Kungliga	Tammelin, Laurentius Gabrieli (1669-1733)	Allmanach på åhret ... 1700 	Allmanach på åhret ... 1700 ...	FALSE	Turku	1699
Kungliga	NA	Wij, Gabriel Falckenberg, Kongl. May:tz 	Wij, Gabriel Falckenberg, Kongl. May:tz Råd och Præsident, uti den Kongl. Hoff-Rätt, i Stoor-Furstendömet Fin-Land ... huruwijda i dhe Sterbhuus där cessio bonorum skeer, Arfwingarne deras Bördesrätt til den cederade egendomen .	FALSE	Turku	1699
Kungliga	NA	Wij, Gabriel Falckenberg, Kongl. Maytz 	Wij, Gabriel Falckenberg, Kongl. Maytz Råd och Præsident, uti den Kongl. Hoff-Rätt, i Stoor-Furstendömet Fin-Land ... nembligen at så snart Delinquenten utstådt det Werldzlige Straffet, som straxt exequeres med Gatulopp, Rijsslijtande eller annat slijkt eller annat slijkt ... så bör Kyrckioplichten straxt där å fölia .	FALSE	Turku	1699
Kungliga	Falander, Jacob (1658-1720)	Itt jordiskt näste uti himmelsk 	Itt jordiskt näste uti himmelsk boning förbyt, och af Hiobs ord i det 29. cap. 18. vers då kongl. borgmestaren uti Nycarleby stad ... Jacob Bockmöller, och cantzlisten uti den stora lag-commission ... Johan Ross, ifrån sin mödosamma	FALSE	Turku	1702
Kungliga	Gezelius, Johannes (1647-1718)	Thed wyrdiga prästerskapet i det 	Thed wyrdiga prästerskapet i det lofl. Åbo stift, önskes nåde och frijd af herranom Gudi! =(Rubr.)=/(Joh: Gezelius. J.f.) =S. impr.=	FALSE	Turku	1702
Kungliga	Florinus, Henricus Matthiae (1633-1705)	Vanhain suomalaisten tavaliset ja suloiset 	Vanhain suomalaisten tavaliset ja suloiset sanan- lascut mahdollisuuden jälken monialda cootut ja nyt wastudest ahkerudella enätyt	FALSE	Turku	1702
Kungliga	Munster, Johan	Oracula Sibyllina	Oracula Sibyllina	TRUE	Turku	1703
Kungliga	NA	Ett rätt barna-klenodium, thet är: 	Ett rätt barna-klenodium, thet är: I. ABC boken. II. Catechismus. III. Spörsmålen. VI. Skriftenes språk. Cum gratia & privileg: s.r. maj:tis. Åbo, tryckt hoos Johan Winter, kongl. bookt. åhr 1704	FALSE	Turku	1704
Kungliga	Rudén, Thorsten (1661-1729)	Finska Helicons underdånige fägne-sånger öfwer 	Finska Helicons underdånige fägne-sånger öfwer the twänne stormächtigste konungars glorwördigst i åminnelse konung Carl den ellofftes, samt nu regerande wår allernådigste och oöfwerwinneligste konungz konung Carl den tolfftes, infallne	FALSE	Turku	1704
Kungliga	Rudén, Thorsten (1661-1729)	Memoria viri, dum fuit, ... 	Memoria viri, dum fuit, ... dn. Christierni Alandri, eloquii romani professoris in illustri ad Auram Academiâ facundissimi, desideratissimi. Parentali sermone consignata, & a. 1704. die 28 Aprilis, in auditorio majori. Recitata â Torst. Rudeen, poës. ibid. prof	FALSE	Turku	1704
Kungliga	Hahn, Petrus (1650-1718)	Sacerdotes veterum virgines	Sacerdotes veterum virgines	FALSE	Turku	1704
Kungliga	Hagert, Daniel (1666-1712)	The andelige strijdzmäns rätta tillstånd; 	The andelige strijdzmäns rätta tillstånd; beskrifwit och förestält i en kort och christelig lijk-predijkan, öfwer den hel. apostelens Pauli afskiedz ord 2. Tim. 4: v.6,7,8. Tå den fordom hög-ädle och wälborne fru, fru Christina Bergenstierna	FALSE	Turku	1704
Kungliga	Garvolius, Jacob (1671-1734)	Helfwetes ewiga jämmer eller The 	Helfwetes ewiga jämmer eller The fördömdas olycksalighet, förestäld uti en enfaldig synodal-predikan, som skedde i Åbo, den 17. januarij, anno 1707. Och sedermehra närwarande säkra werlden till trogen åtwarning, efter befallning i tryck	FALSE	Turku	1707
Kungliga	Wijkar, Jacob	I.N.J. Tractatum, de Phocis in 	I.N.J. Tractatum, de Phocis in sinu Bothnico capi solitis ...	TRUE	Turku	1707
Kungliga	Juslenius, Daniel (1676-1752)	Justæ laudes, in regiam majestatem 	Justæ laudes, in regiam majestatem viri dum viveret perspectæ fidei ... Erici Loskioeld, assessoris quondam in supremo, quod Aboæ fennorum est, judicio regio ... in celebri ae [!] frequenti magnorum eruditorumque virorum consessu, Nonis	FALSE	Turku	1707
Kungliga	Rudén, Thorsten (1661-1729)	Lijk-cypress, til en christelig åminnelse, 	Lijk-cypress, til en christelig åminnelse, af edel och högachtad herr Johan Saehls, i sin lifztijd berömlig justitiæ borgmästare här i stapel-staden Åbo; tå thesz andelöse lekamen, til sin hwijlostad här i doom-kyrckian beledsagades	FALSE	Turku	1707
Kungliga	Lilius, Henrik G	Triga requisitiorum eruditionis comparandæ [Diss. 	Triga requisitiorum eruditionis comparandæ [Diss. Præs	TRUE	Turku	1707
Kungliga	Edenius, Jordan Nilsson (1624-1666)	Epitome hostoriæ ecclesiasticæ novi testamenti, 	Epitome hostoriæ ecclesiasticæ novi testamenti, ante aliquot annos ab eximio quodam in patriâ theologo.	FALSE	Turku	1708
Kungliga	Prysz, Anders	Expositio transformationis lacrymarum Heliadum in 	Expositio transformationis lacrymarum Heliadum in electrum, exercitatione academica adumbrata	TRUE	Turku	1708
Kungliga	Hagert, Daniel (1666-1712)	Fons sangvineus in septentrione, eller 	Fons sangvineus in septentrione, eller En i Norden upsprungen och starckt flytande blodz-kiälla, i anledning af evangelio Matth. IX. 20. seq. /conf. Marc. V. v. 29./ som inföll å den XXIV söndagen effter trinitatis a. 1706. Å hwilken	FALSE	Turku	1708
Kungliga	Chytraeus, Nathan (1543-1598)	Grammatica latina, in gratiam discentium, 	Grammatica latina, in gratiam discentium, magna ex parte in sueticum idioma, qva fieri potuit, fidelitate, translata, â m. Arvido J. Tidero, denuò sub incudem revocata, atq'; in locis quibusdam aucta, imprimis ad syntaxin sit appendix	FALSE	Turku	1708
Kungliga	Malmberg, Petrus (1653-1710)	Roosen ibland törne: thet är 	Roosen ibland törne: thet är christendomens sanning, af åthskillige swärmare wid thenna tijden anfächtad: men korteligen förswarad af ... Petro Malmberg, den h. skriffts licentiato: när han i Wittenberg, med wahnlig solennitet blef theologiæ	FALSE	Turku	1708
Kungliga	Rudén, Thorsten (1661-1729)	Testament, hwilket ehreborne och hög- 	Testament, hwilket ehreborne och hög- wälachtad nu i herranom salig herr Adolph Wittfot, berömlig rådman i stapelstaden Åbo, samt præses wid then loflige cemnär-rätten sammastädes, allom, som i Jesu Christi troo, sachtmodighet och tålamod	FALSE	Turku	1708
Kungliga	Gezelius, Johannes (1647-1718)	En trogen lärares wälsignelser, af 	En trogen lärares wälsignelser, af psalm. 84: v.7. Vthi en christelig lijk-predikan, när ... nu hoos Gudh salige herr Matthias Erici Berg, wälmeriterad kyrckioherde i Jomala sokn, samt berömlig probst öfwer Åland: widh en ansenlig begrafning	FALSE	Turku	1709
Kungliga	Diecmann, Johann (1647-1720)	Oförgripelige tanckar öfwer fyra frågor, 	Oförgripelige tanckar öfwer fyra frågor, angående privat communion, eller then hel. nattwardsens särskilte uthdelande och annammande. Effter begäran upsatte af d. J.D. ... På swenska öfwersatte af A.Æ. Hwar wid bijfoges en inländsk lärares skrift om samma samwetsmåhl. Tryckt i Åbo, af H.C. Merckell, kongl. booktr. åhr 1709	FALSE	Turku	1709
Kungliga	Hafenreffer, Matthias (1561-1619)	Synopsis, eller Ett kort begrep, 	Synopsis, eller Ett kort begrep, af then evangeliska lärans förnämsta hufwud-stycken: i anledning af the mindre d. Matth. Haffenrefferi böcker, sammandragit af Andrea Frostero ... Åbo, tryckt hoos Henr. C. Merckell, kongl. booktr. 1709	FALSE	Turku	1709
Kungliga	Alanus, Abraham	Dissertatio historico - philologica, Johannem 	Dissertatio historico - philologica, Johannem Baptistam, in nativitate, vita, & morte, insignem, exhibens	FALSE	Turku	1710
Kungliga	Bange, Anders (NA-1749)	Menniskiornas allmänne usellheet och jämmer, 	Menniskiornas allmänne usellheet och jämmer, wijst wid then fordom ähreborne och wälachtade, nu mehra, hoos Gud salige, herr Christian Gottfried Reimans hederlige jordefärd; i Åbo doomkyrckia den 3 martii 1710. Vti en kort och enfaldig	FALSE	Turku	1710
Kungliga	Gezelius, Johannes (1647-1718)	Thet wyrdige presterskapet i thet 	Thet wyrdige presterskapet i thet låflige Åbo stifft önskas nåde och frijd af herranom Gudi! =(Rubr.)=/(Joh. Gezelius. J.f.) =S. impr.=	FALSE	Turku	1710
Kungliga	NA	Cuningall:sen Maij:tin Armollisin Placati, Yhteisen 	Cuningall:sen Maij:tin Armollisin Placati, Yhteisen Cansan Restantiein eli sisälleseisowaistein päällepanoin myöden eli andexi andamisesta . Annettu Benderin tykönä sinä cahdexandena päiwänä Tammicuusa Wuonna 1711	FALSE	Turku	1711
Kungliga	Hahn, Petter	De aquis supra coelestibus	De aquis supra coelestibus	FALSE	Turku	1711
Kungliga	Vultejus, Johannes (1639-1700)	En konungs och regents christeliga 	En konungs och regents christeliga rådh och estats-man, widh kongl. maij:tz fordom högtbetrodde mans, råds och drotzetz, general justitiæ directors, öfwer Swerige, Finland och thes vnderliggiande provincier; så ock Vpsala academiæ cancellers	FALSE	Turku	1716
Kungliga	Leijonmarck, Jacob (1697-1735)	Enfaldigt, doch wälment fägne-tahl, då 	Enfaldigt, doch wälment fägne-tahl, då den högl. kongl. hoff-rätten i stor-furstendömet Finland belefwade ett seculum eller det hundrade åhret, sedan den, genom Guds nåd, lyckeligen sin början fick, hållit uti Åbo academie den 15 junii	FALSE	Turku	1723
Kungliga	Phaedrus, 	Fabularum AEsopiarum,libri quinque, secundum recensionem 	Fabularum AEsopiarum,libri quinque, secundum recensionem optimam cum indice fabularum ad calcem addito, in usum scholarum ac studiosae, in patria, pubis denuo editi, cura atq. sumtibus Christiani Trapp	FALSE	Turku	1724
Kungliga	Scarin, Algot (1684-1771)	Positiones historico-politicæ e Chronico episcoporum 	Positiones historico-politicæ e Chronico episcoporum m. scr. Pauli Justen excerptæ	TRUE	Turku	1726
Kungliga	Laurelius, Olof (1585-1670)	Articulorum fidei synopsis biblica in 	Articulorum fidei synopsis biblica in usum scholasticæ juventutis, sub imperio regni Sveciæ viventis collecta. Eller Trones artiklar, korteligen utaf den helige Bibel författade af Olavo Laurelio ... Åbo, med Christian Trapps bekostnad	FALSE	Turku	1728
Kungliga	Fahlenius, Jonas (1674-1747)	En christelig lijk-predikan öfwer för 	En christelig lijk-predikan öfwer för detta hans kongl. maj:ts tro man och biskop i Åbo stift, samt procancellarius wid kongl. academien dersammastädes ... Hermann Witte, när thes andelöse lekamen den 19. junii åhr 1728. uti en högförnemlig och folckrik församlings närwaro til sin graf i Åbo domkyrckia beledsagades. Hållen af Jonas Fahlenius ... Åbo, tryckt af Joh. Kiämpe kongl. acad. boktr	FALSE	Turku	1728
Kungliga	Fahlenius, Jonas (1674-1747)	En christelig lik-predikan öfwer den 	En christelig lik-predikan öfwer den i lifstiden wähl-ehreborna och dygderika, men nu hos Gud ewinnerligen saliga ... Margaretha Wittfoot, när des andelösa lekamen efter en wäl fulländad wandel, christelig beredelse och salig död til	FALSE	Turku	1728
Kungliga	Haartman, Johan (1682-1737)	De primis idololatriæ initiis dissertatio 	De primis idololatriæ initiis dissertatio academica, quam ... suffultus præsidio mag. Johannis Haartman, ... publice ventilandam modeste proponit ... Laurentius Ekedahl Wex. Smol. Ad diem in audit. max. VIII. Martii M.DCC.XX.IX	NA	Turku	1729
Kungliga	Scarin, Algot (1684-1771)	Dissertatio historico politica de condominiis 	Dissertatio historico politica de condominiis superioris ævi Svethicis, qvam ... Præside viro cl. m. Algotho A. Scarin. ... Pro honoribus philosophicis ad diem21. Junii MDCCXXIX, publice examinandam sistet Fabian N Gudseus, Nylandus. Loco & horis consvetis	NA	Turku	1729
Kungliga	Wetterhoff, Anders Georg (1707-1772)	Vnderdånig fägnad betygad, öfwer hans 	Vnderdånig fägnad betygad, öfwer hans kongl, maj:ts wår allernådigste konungs konung Friedrich den I. Sweriges, Giötes, och Wendes konungs &c. &c. &c. samt hela kongl. husets flor, på hans kongl. maj:ts födelse-dag. Den 17. aprill, åhr	FALSE	Turku	1729
Kungliga	Fahlenius, Jonas (1674-1747)	Trones kamp och seger samt 	Trones kamp och seger samt thesz härliga belöning i enfaldighet förestält af 2. Tim. 4. v. 6.7.8. när ... nu mehra saliga fru grefwinnan, Anna Charlotta Taube, hans kongl. maj:ts tro manns och öfwerst lieutenants ... Robert Muhls högtälskeliga	FALSE	Turku	1730
Kungliga	Fortelius, Petrus Gabrielsson	De primis initiis Björneburgi, Satacundiæ 	De primis initiis Björneburgi, Satacundiæ civitatis in Fenningia	FALSE	Turku	1732
Kungliga	Scarin, Algot (1684-1771)	Disqvisitionis academicæ, de Sveonum in 	Disqvisitionis academicæ, de Sveonum in Livoiam meritis, primæ lineæ, paucissimis thesibus expresiæ: quas ... Præside cl. viro mag. Algotho A. Scarin, ... pro solitis in philosophia honoribus, discutiendas sistit Jonas Kiellgren V. Goth. ips kal. Julii 1732. hor. pomerid	NA	Turku	1732
Kungliga	Scarin, Algot (1684-1771)	Exercitium academicum apotheseos veteris et 	Exercitium academicum apotheseos veteris et recentioris parallelismum exhibens	TRUE	Turku	1732
Kungliga	Tammelin, Lars (1669-1733)	Vox cœli de beata reqvie 	Vox cœli de beata reqvie pie defunctorum, eller Himmelens röst om de trognas saliga ro efter döden, vthaf Guds ord enfaldigt förestält, tå ... professorskan och domprobstinnan, Agatha Siöberg, Fahlenia ... Jonae Fahlenii, högtberömlig	FALSE	Turku	1732
Kungliga	Vhael, Barthold (1667-1723)	Grammatica fennica, adcuratiore methodo, penitiore 	Grammatica fennica, adcuratiore methodo, penitiore cura, observatione, & labore, reserans antiqvissimæ hujus, ac natura sua præstantissimæ linguæ adyta, ejus peculiarem, ab aliis Europæis lingvis differentem genium, flexiones & conjugationes	FALSE	Turku	1733
Kungliga	Vhael, Barthold G	Grammatica fennica...Opus posthumum	Grammatica fennica...Opus posthumum	FALSE	Turku	1733
Kungliga	Spöring, Herman Diedrich (1701-1747)	Medicina salernitana id est conservandæ 	Medicina salernitana id est conservandæ bonæ valetudinis præcepta, in usum collegii privati edita. Ab H.D.S	FALSE	Turku	1733
Kungliga	NA	Uusi Testamenti,.	Uusi Testamenti,.	FALSE	Turku	1733
Kungliga	Frost,petrus, 	De jure episcopali	De jure episcopali	FALSE	Turku	1734
Kungliga	Hassel, Henrik (1700-1776)	Dissertatio historico-politica [acad. resp	Dissertatio historico-politica [acad. resp	FALSE	Turku	1734
Kungliga	Hassel, Henrik (1700-1776)	Dissertatio historico politica, de injuriis 	Dissertatio historico politica, de injuriis regni papistici in principes regnumqve Sveciae qvam cum consensu amplissimi senatus philosophici in illustri academia Aboensi præside Henrico Hassel ... candido bonorum examini modeste submittit. Alumnus regius Petrus Tolsdorf. Smolandia Svecus. Die XXIII, Martii anni MDCCXXXIV in auditor. max. horis consvetis	NA	Turku	1734
Kungliga	Fortelius, Gabriel (1700-1788)	Enfaldig betrachtelse om the froma 	Enfaldig betrachtelse om the froma eller rätthiertada Guds barnas berömelse tå hans kongl. maj:ts tro- man och biskop öfwer Borgo stift ... Johannes Gezelius J.F.I.N. Nu mera hos Gud salige til sin på jorden efterlemnade del, wid en	FALSE	Turku	1734
Kungliga	Zum Felde, Nicolaus (1678-1748)	Inledning til tyska språket, then 	Inledning til tyska språket, then studerande ungdomen, wid kongl. academien i Åbo, til tienst och nytta af de bästa philologis och grammaticis, med flit, i möjeligaste korthet sammandragen och författad af Nicolao zum Felde. Cum consens	FALSE	Turku	1734
Kungliga	Hassel, Henricus (1700-1776)	Dissertatio gradualis de diæta studiosorum, 	Dissertatio gradualis de diæta studiosorum, qvam annuente amplissima facult. philos. præside, Henrico Hassel, eloqv. profess. & h. t. ac. rect. In acad. Aboënsis auditorio maxim. Horis diei ... Junii a. m. solitis ao. MDCCXXXV. Examinandam sistit Carolus F. Mennander Andr. fil. O-Botn	NA	Turku	1735
