catalog	author	short_title	title	dissertation	publication_place	publication_year
Kungliga	Salenius, Ericus Matthiæ (1600-NA)	Oratio de castitate	Oratio de castitate	FALSE	Turku	1631
Kungliga	Forladius, Jacob (1625-1674)	Oratiuncula laboris præstantiam necessitatem ac 	Oratiuncula laboris præstantiam necessitatem ac utilitatem ... adumbrans	FALSE	Turku	1631
Kungliga	Holmius, Jacobus Eliæ (1697-NA)	Oratio in proverbium, heroum filii 	Oratio in proverbium, heroum filii noxæ	FALSE	Turku	1633
Kungliga	Wargius, Martinus Andreae (1600-NA)	Brevis et succincta commendatio Bothniæ 	Brevis et succincta commendatio Bothniæ orientalis. Quam, in Regia Academia Aboensi Anno 1643. 3 Maji in Auditorio Majori finitis precibus matutinis horâ octavâ publicè enarrabat Martinus A. Vvargius .	FALSE	Turku	1643
Kungliga	Rothovius, Isac (1572-1652)	Några christeliga boot predikningar, håldne 	Några christeliga boot predikningar, håldne aff Isaaco B. Rothovio ... effter några godha menners begäran aff trycket vthgångne ministerio diœcesano til tienst, at the på the åhrlighe stora bönedaghar brukas kunna i församblingarna .	FALSE	Turku	1643
Kungliga	Kempe, Axel (1623-1682)	Oratio de ardua et difficultatis 	Oratio de ardua et difficultatis plena eruditionis consecutione	FALSE	Turku	1643
Kungliga	Svenonius, Enevald (1617-1688)	Oratio delineationem magnanimitatis exhibens.... In 	Oratio delineationem magnanimitatis exhibens.... In Regiæ Academiæ Finnonum, quæ est Aboæ, superiori Auditorio,... Anni 1643. Publicè eloquebatur Enevaldus Suenonius .	FALSE	Turku	1643
Kungliga	Lagercrona, Johannes Matthiae (1618-1674)	Encomium medicinæ... In Nova ac 	Encomium medicinæ... In Nova ac regia quæ est Aboæ Finnonum Academia, Anni nostræ reparationis M DC XLIV. die 28. Martij in Auditorio Majori,... Johannes Matth. Munthelius.	FALSE	Turku	1644
Kungliga	Petri, Laurentius (1671-1573)	Muutamat christilliset saarnat yhteisest-synnin tunnustoxest 	Muutamat christilliset saarnat yhteisest-synnin tunnustoxest ia hywästisiunauxest,	FALSE	Turku	1644
Kungliga	Sneckenberg, Jakob (1625-1697)	Oratio de adulatione agnoscenda et 	Oratio de adulatione agnoscenda et fugienda	FALSE	Turku	1644
Kungliga	Rothovius, Gudmundus Jacobi (1691-NA)	Oratio de dira illa vitæ 	Oratio de dira illa vitæ humanæ peste voluptate	FALSE	Turku	1644
Kungliga	Curnovius, Johannes Henrici (1600-NA)	Oratio successioni electionis fasces submittendos 	Oratio successioni electionis fasces submittendos esse demonstrans	FALSE	Turku	1644
Kungliga	Anglenius, Simon Caroli (1600-NA)	Oratio veræ amicitiæ encomia exhibens	Oratio veræ amicitiæ encomia exhibens	FALSE	Turku	1644
Kungliga	Petri, Laurentius (1671-1573)	Selityxet ioca-päiwäisten huomen-ehtoia ruocalucuin eli 	Selityxet ioca-päiwäisten huomen-ehtoia ruocalucuin eli siunausten, yxikertaisil saarnoill edespannut	FALSE	Turku	1644
Kungliga	Ulstadius, Andreas Andreae (1668-NA)	Svecia triumphans sive Oratio de 	Svecia triumphans sive Oratio de capta classe danica. Anno 1644. mense septemb	FALSE	Turku	1644
Kungliga	Baazius, Benedictus Johannis (1600-NA)	Declamatiuncula de oculo humano	Declamatiuncula de oculo humano	FALSE	Turku	1645
Kungliga	Rothovius, Isac (1572-1652)	Een christelig predican hållen vthi 	Een christelig predican hållen vthi alla församblingar öfwer hela thet lofliga bischopz stifftet Abo, vppå then högtideliga och vthi een ewigh åminnelse hoos osz och efterkommanderna in schrifwande tackseijälse daghen 7. novemb. anno 1645. för then stora och höga Gudz wälgerning och faderliga mildheet, at thet blodigha krijget emellan wårt k. fädernesland Sweriges rijke och Danmark, är genom Gudz welisgnelse ... vthi en trygg frid och roliggheet, schrifwen och vnder trycket gifwen aff Isaaco B. Rothovio .	FALSE	Turku	1645
Kungliga	Agricola, Christianus Christiani (1600-NA)	Oratiuncula de occasione oportune oblata	Oratiuncula de occasione oportune oblata	FALSE	Turku	1645
Kungliga	Folkernius, Laurentius Johannis (1618-1674)	Oratiuncula gratulatoria: ob pacem cum 	Oratiuncula gratulatoria: ob pacem cum Dano initam	FALSE	Turku	1645
Kungliga	Rothovius, Isac (1572-1652)	Then christeligha läran om een 	Then christeligha läran om een sanskyllig boot och bättring, och om een saligh beredelse til ... Jesu Christi tilkommelse .	FALSE	Turku	1645
Kungliga	Rothovius, Isac (1572-1652)	Een christeligh liik-predican om menniskiones 	Een christeligh liik-predican om menniskiones ostadiga lägenheet i thenna werldenne och then tröst som wij ther emoothafwe uthi then wälb. herrens H.K.M:ts sampt Sweriges rijkes fordom högbetrodde man nu saligh hoos gudi Torsten Stålhandskes til Humelsund, Öfwerby och Alten, general öffuer cavallerijt och öffuerste öffuer itt regemente til häst och itt regemente til foot, begraffning hwilken ifrå thenna werldenne i herranom roligen affsompnadhe uthi Hadersleben den 21 aprilis om påskedagen anno 1644	FALSE	Turku	1646
Kungliga	Gyldenstolpe, Michael Olai Wexionius (1609-1670)	Ethices præcepta	Ethices præcepta	FALSE	Turku	1646
Kungliga	Gyldenstolpe, Michael Olai Wexionius (1609-1670)	Ethices præcepta	Ethices præcepta	FALSE	Turku	1646
Kungliga	NA	Manuale finnonicum, se on: Muutamat 	Manuale finnonicum, se on: Muutamat tarwittawat ia aina käsillä pidettäwät suomenkieliset kirjat, ...	FALSE	Turku	1646
Kungliga	Chronander, Jacobus Petri (1694-NA)	Oratio amplissimæ regionis Westrogothiæ descriptionem, 	Oratio amplissimæ regionis Westrogothiæ descriptionem, ... repræsentans: .	FALSE	Turku	1646
Kungliga	Petraeus, æschillus (1593-1657)	The gudfruchtigas friimodigheet, förklarat uthi 	The gudfruchtigas friimodigheet, förklarat uthi en predican, när H.K.M.:tz och Sweriges rijkes troo mans wedh H.K.;-:tz armeer i Tyskland och Danmarck, förordnade generals öffuer cavalleriet och öfwerstes til häst och foot, den ädle och wälborne H. Torsten Stålhandskes til Humelsund, Öfwerby och Alten s. lijk medh anseenligh proces augusti anno 1645 fördes aff Åbo Slott in uthi Doomkyrckian i Åbo til des legerstadhb	FALSE	Turku	1646
Kungliga	Greek, Jacobus Johannis (1600-NA)	Declamatio de philosophiæ natura	Declamatio de philosophiæ natura	FALSE	Turku	1647
Kungliga	Kindius, Petrus Olai (1600-NA)	Oratio de quotidiano conscientiæ examine	Oratio de quotidiano conscientiæ examine	FALSE	Turku	1647
Kungliga	Myricius, Ericus Christophori (1679-NA)	Oratio de Sveciæ patriæ nostræ 	Oratio de Sveciæ patriæ nostræ dulcissime amore	FALSE	Turku	1647
Kungliga	Rothovius, Gudmundus Jacobi (1691-NA)	Oratio pietatis officia simpliciter adumbrans	Oratio pietatis officia simpliciter adumbrans	FALSE	Turku	1647
Kungliga	Gyldenstolpe, Michael Olai Wexionius (1609-1670)	Politica præcepta ad statum imp. 	Politica præcepta ad statum imp. gothico svetici accommodata, domesticisq; passim exemplis illustrata	FALSE	Turku	1647
Kungliga	Gyldenstolpe, Michael Olai Wexionius (1609-1670)	Rota fortunæ in promotione magistrali, 	Rota fortunæ in promotione magistrali, qvæ secunda Aboæ habita 4. Maji. 1617. circumacta & volutata: cum ipsis promotionis ritibus & acclamatio nibus publicé recitatis. .	FALSE	Turku	1647
Kungliga	Chronander, Jacobus Petri (1694-NA)	Surge eller flijt och oflitighetz 	Surge eller flijt och oflitighetz skode spegel, författat vthi een lustigh comoedia, j hwilken lättia och flijtigheet, besynnerligen bland studerande personer, med sine rätte färgor, . .. beskrifwes: .	FALSE	Turku	1647
Kungliga	NA	Wähä kirja, cuinga jumalan palwelus 	Wähä kirja, cuinga jumalan palwelus christillisen tawan jälken meidän seoracunnisam pidetän; .	FALSE	Turku	1647
Kungliga	Ulvichius, Johannes Jonae (1600-NA)	Ähreskrift öfwer thet cappellet som 	Ähreskrift öfwer thet cappellet som ... H. Hendrich Flemming, til J Lechtis, ... mz sin bekostnadt hafwer vthaf grund låtit vpbyggia, vthi Wirmo sochn, åhr efter Christi födhelse 1645	FALSE	Turku	1647
Kungliga	Gyldenstolpe, Michael Olai Wexionius (1609-1670)	Natales Academiæ Aboensis; serenissimæ ac 	Natales Academiæ Aboensis; serenissimæ ac potentissimæ principi & dominæ, dn. Christinæ Augustæ d. g. regnorum Sueciæ, Gothiæ vandaliæq[ue] reginæ; castrorum, musarum & totius patriæ matri; prædictarum Athenarum fundatrici & altrici magnæ, piæ, felici; humilimè ac devotissim dicati & consecrati	FALSE	Turku	1648
Kungliga	Arctopolitanus, Gabriel Gregorii (1630-1682)	Oratiuncula de innata sciendi cupiditate 	Oratiuncula de innata sciendi cupiditate scientiarumq; dignitate	FALSE	Turku	1648
Kungliga	Gyldenstolpe, Michael Olai Wexionius (1609-1670)	Collegium ethicum præcipuas quæstiones & 	Collegium ethicum præcipuas quæstiones & notabiliores controversias, in generali philosophiæ practicæ parte occurrentes	FALSE	Turku	1649
Kungliga	Betulander, Jonas Benedicti (1670-NA)	Een christeligh Ny-åhrs-skrift	Een christeligh Ny-åhrs-skrift	FALSE	Turku	1649
Kungliga	Arenius, Olaus Magni (1682-NA)	Een christeligh predijkan öfwer then 	Een christeligh predijkan öfwer then 18. psalmen v. 47. ad finem. Hållen på then allmennelighe tackseyelse dagen, som effter h. k. mtz wår allernådigste drottningz gudelighe befalning fijrades i alla församblingar, vthi heela Sweriges rijke, och thes vnderhörande landskaper, anno 1649. then 8. decembris. Stält och hållen aff Olao Magni Arenio .	FALSE	Turku	1649
Kungliga	NA	Kuningalisen may:tin Wahwistus, Annettu Ychteisellä 	Kuningalisen may:tin Wahwistus, Annettu Ychteisellä Canssalle Maalle, Skydin ia Gästningin Wapaudhen päälle, Wastoin Skydin rahan Vlgos Tekemistä	FALSE	Turku	1649
Kungliga	Petraeus, æschillus (1593-1657)	Linguæ finnicæ brevis institutio, exhibens 	Linguæ finnicæ brevis institutio, exhibens vocum flectiones per casus, gradus & tempora, nec non partium indeclinabilium significationem, dictionumq; constructionem & prosodiam .	FALSE	Turku	1649
Kungliga	Gelsenius, Sveno Theodori (1619-1676)	Logarion peri tes ton nekron 	Logarion peri tes ton nekron anastaseos .	FALSE	Turku	1649
Kungliga	Collinus, Johannes Nicolai (1600-NA)	Oratio de studio pietatis amplectendo	Oratio de studio pietatis amplectendo	FALSE	Turku	1649
Kungliga	Revonius, Johannes Benedicti (1693-1695)	Oratiuncula de præcursore domini Johanne 	Oratiuncula de præcursore domini Johanne Baptsita(!	FALSE	Turku	1649
Kungliga	Gyldenstolpe, Michael Olai Wexionius (1609-1670)	Brevis Eisagoge ad studium juris 	Brevis Eisagoge ad studium juris civilis Sveco-romani; cum collatione utriusq	FALSE	Turku	1650
Kungliga	Gyldenstolpe, Michael Olai Wexionius (1609-1670)	Epistola deambulationem ad argenti-fodinas occidentaliores 	Epistola deambulationem ad argenti-fodinas occidentaliores ante ann: 13. institutam breviter repetens	FALSE	Turku	1650
Kungliga	Gyldenstolpe, Michael Olai Wexionius (1609-1670)	Epitome descriptionis Sueciæ, Gothiæ, Fenningiæ, 	Epitome descriptionis Sueciæ, Gothiæ, Fenningiæ, et subjectarum provinciarum. Accuratiùs quàm unquam antehâc editæ	FALSE	Turku	1650
Kungliga	Chronander, Jacobus Petri (1694-NA)	Fasciculus juridicus, præcipua digestorum contenta, 	Fasciculus juridicus, præcipua digestorum contenta, secundum seriem titulorum, novem disputationibus comprehendens ...	FALSE	Turku	1651
Kungliga	Laxenius, Jacobus Martini (1687-NA)	Oratio de vera ac christiana 	Oratio de vera ac christiana patientia sub cruce retinenda	FALSE	Turku	1651
Kungliga	Gyllenius, Petrus (1622-1675)	Oratio metrica scripta, de Christo 	Oratio metrica scripta, de Christo celso, conservatore benigno, et Christi meritis, & Christiadum cruciatu ... ex cathedrâ Petrus Magni Gyllenius ... cum decimo sexto palleret Martius ortu, a Salvatoris supremi judicis anno .	FALSE	Turku	1652
Kungliga	Florinus, Ericus Matthiæ (1600-NA)	Oratiuncula de modestia	Oratiuncula de modestia	FALSE	Turku	1652
Kungliga	Kexlerus, Simon Svenonis (1602-1669)	Almanach 1654. ...	Almanach 1654. ...	FALSE	Turku	1653
Kungliga	Fabricius, Eschillus Svenonis (1692-NA)	Oratio de encomio artium liberalium	Oratio de encomio artium liberalium	FALSE	Turku	1653
Kungliga	Ståhlfoot, Andreas Benedicti (1676-NA)	Oratio de paupertate ejusq; utilitate	Oratio de paupertate ejusq; utilitate	FALSE	Turku	1653
Kungliga	Purmerus, Johannes Johannis (1600-NA)	Oratio de literis amplectendis et 	Oratio de literis amplectendis et otio fugiendo	FALSE	Turku	1654
Kungliga	Julinus, Ericus Andreae (1654-NA)	Oratio pietatis studium adumbrans	Oratio pietatis studium adumbrans	FALSE	Turku	1654
Kungliga	Gyldenstolpe, Michael Olai Wexionius (1609-1670)	Michaelis Gyllenstålpe collegium ethicum, præcipuas 	Michaelis Gyllenstålpe collegium ethicum, præcipuas quæstiones & notabiliores controversias, in generaliori philosophiæ practicæ parte occurrentes; XIII. disputationibus discussas atq`; enodatas exhibens. In regiâ universitate Aboensi à selectoribus horum studiorum & virtutum cultoribus, juvenibus præstantissimis, quorum nomina sequens pagina exhibet, institutum. Secunda editio.; 1655	FALSE	Turku	1655
Kungliga	Siggonius, Laurentius (1626-1694)	Oratio de divini verbi sufficientiâ	Oratio de divini verbi sufficientiâ	FALSE	Turku	1655
Kungliga	Florinus, Thomas Martini (1703-NA)	Oratio veritatem ... adumbrans	Oratio veritatem ... adumbrans	FALSE	Turku	1655
Kungliga	NA	Mwtamat christelliset rucouxet, jumalan seuracunnasa 	Mwtamat christelliset rucouxet, jumalan seuracunnasa ychtisest, lijatengin saarnastolist luettawat	FALSE	Turku	1656
Kungliga	Gyldenstolpe, Michael Olai Wexionius (1609-1670)	Michaelis GyllenStålpens etc. Oratio de 	Michaelis GyllenStålpens etc. Oratio de bibliothecis in genere; et in specie de bibliotheca Regiæ Academiæ Aboënsis	FALSE	Turku	1657
Kungliga	Gyldenstolpe, Michael Olai Wexionius (1609-1670)	Michaelis Gyllenstålpens Politica, ad modernum 	Michaelis Gyllenstålpens Politica, ad modernum imperij Sueo-gothici statum accomodata; domestiicisque passim exemplis illustrata: quo genuina ejusdem facies luculentiùs exprimatur ; nunc revisa, ad multorum vota publici iterum juris facta ; et ab authore prælo submissa	FALSE	Turku	1657
Kungliga	Binningius, Ericus Johannis (1600-NA)	Oratio de eloquentia	Oratio de eloquentia	FALSE	Turku	1657
Kungliga	Rauthelius, Johannes Danielis (1704-NA)	Oratio de encomio Aboæ	Oratio de encomio Aboæ	FALSE	Turku	1657
Kungliga	Hasselgren, Henricus Petri (1698-NA)	Oratio de sobrietate	Oratio de sobrietate	FALSE	Turku	1657
Kungliga	Nicolai, Joachimus (1671-NA)	Oratio comple-ctens brevem delineationem passionis 	Oratio comple-ctens brevem delineationem passionis et mortis ... Jesu Christi	FALSE	Turku	1658
Kungliga	Lantzbergh, Johannes (1600-NA)	Oratio de militia palatina ... 	Oratio de militia palatina ... in Regiâ Academiâ quæ ... in Auditorio Majori 31 Octobris Anno 1658 pronunciavit Johannes Lantzbergh,.	FALSE	Turku	1658
Kungliga	Helsingius, Marcus Georgii (1678-NA)	Oratio de s. s. studio 	Oratio de s. s. studio theologico	FALSE	Turku	1658
Kungliga	Gallenius, Andreas Swenonis (1600-NA)	Oratio topographica de encomio Calmariæ	Oratio topographica de encomio Calmariæ	FALSE	Turku	1658
Kungliga	Simonius, Isaacus Roslagius (1600-NA)	Encomium Arbogiæ	Encomium Arbogiæ	FALSE	Turku	1659
Kungliga	Kolmodin, Erik (1630-1665)	Genesis ætherea eller Jesu Christi 	Genesis ætherea eller Jesu Christi födelse hwilken sigh tildrogh effter wärdenes skapelse 3970. vthi keyser Augusti 31. regementz åhr, som nu aff osz christne, Christo til ewigh åminnelse, åhrligen begås, den 25. dagh vthi decem. månad; vthi en enfaldigh comoedia fattat, hwilken innewarande åhr [1]659. den 9. jan. publice celebrerades i Åbo stad, vthi höge herrars närwaro, oc förnembligit folckz frequens, med serdeles personer, och den qualitet man aff historiens grund hempta kunde aff Erico Kolmodino .	FALSE	Turku	1659
Kungliga	Abrahami, Abrahamus (1675-NA)	Hircus emissarius novi foederis, se 	Hircus emissarius novi foederis, se on: Jesuxen Christuxen meidän ainoan wälimiehem, kärsimisen historia;	FALSE	Turku	1659
Kungliga	Arenius, Olaus Magni (1682-NA)	Labores catechetici thet är enfaldige 	Labores catechetici thet är enfaldige catechismi förklarningar, vthi 28 predikningar författade, stälte och predikade vthi Maalax försambling i Öster Bothn. aff Olao Magni Arenio ... Allom them som then christeliga catechismi läran älska och gärna läsa, til nyttigh och helsosam vnder wisningh, vnder trycket gifne och vthgångne medh aut: bekostnad	FALSE	Turku	1659
Kungliga	Lohrman, Bernhard Gertsson (1673-NA)	Oratio illius celeberrimæ fodinæ metallicæ 	Oratio illius celeberrimæ fodinæ metallicæ prope Falhunam in Dalecarlia. orientali, laudem ac descriptionem .. . continens	FALSE	Turku	1659
Kungliga	Ringius, Magnus Nicolai (1600-NA)	Oratio metrica, leges in republicâ 	Oratio metrica, leges in republicâ per necessarias esse	FALSE	Turku	1659
Kungliga	Thuronius, Andreas (1632-1665)	Andreæ Thuronii Institutiones logicæ, cum 	Andreæ Thuronii Institutiones logicæ, cum præmisso brevi de philosophia in genere tractatu, in regiâ academiâ Aboensi publice propositæ	FALSE	Turku	1660
Kungliga	Naesenius, Esaias Gregorii (1707-NA)	Oratio carmine scripta de Christo 	Oratio carmine scripta de Christo passo conservatore potenti	FALSE	Turku	1660
Kungliga	Enebergh, Salomon L (NA-1667)	Oratio celebris emporij Nycopensis encomium 	Oratio celebris emporij Nycopensis encomium simpliciter adumbrans	FALSE	Turku	1660
Kungliga	Hasselgren, Elias Petri (1600-NA)	Oratio de acedia vitanda et 	Oratio de acedia vitanda et diligentia amplectenda	FALSE	Turku	1660
Kungliga	Thuronius, Johannes (1701-NA)	Oratio de Deo ter opt. 	Oratio de Deo ter opt. max. uno in essentia, trino in personis	FALSE	Turku	1660
Kungliga	Simonius, Isaacus Roslagius (1600-NA)	Oratio brevem delineationem instabilitatis et 	Oratio brevem delineationem instabilitatis et miseriæ humanæ vitæ exhibens, quam divinâ adjuvante clementiâ in Regia ac florentissima christinea Academia, quae Aboæ Fennorum est ad Auram, dominica palmarum a. 1661. in auditorio supremo & maximo, finitis sacris vespertinis, pro concione eloquebatur Isaacus Simonius Arbogia-Svecus	FALSE	Turku	1661
Kungliga	Hult, Elias Andreae (1600-NA)	Oratio continens Sudermanniæ laudem ac 	Oratio continens Sudermanniæ laudem ac delineationem	FALSE	Turku	1661
Kungliga	Arenius, Olaus Magni (1682-NA)	Passional postilla. Thet är historia 	Passional postilla. Thet är historia om Jesu Christi wår herres och frelsares pijna, dödh och begrafning. Såsom hon aff alla ewangelisterna vthdragen, och i sex achter fördelt är. Medh nyttiga lärdomar, helsosam tröst och trogna förmaningar. Vthi fiorton predikningar, medh ett nyttigt register. Eenfalleliga författat och til trycket förfärdigat aff Olao Magni Arenio ... Medh egen bekostning. .	FALSE	Turku	1661
Kungliga	Flachsenius, Jacobus Henrici (1633-1694)	Almanach, til thet åhret ... 	Almanach, til thet åhret ... 1663 .	FALSE	Turku	1662
Kungliga	Vellerius, Jacobus Bergeri (1683-NA)	Oratio de medijs eruditionis parandæ 	Oratio de medijs eruditionis parandæ præcipuis, et insigni inde pullulante utilitate	FALSE	Turku	1662
Kungliga	Hasselgren, Elias Petri (1600-NA)	Oratiuncula encomium Alandiæ simpliciter & 	Oratiuncula encomium Alandiæ simpliciter & succinctè adumbrans	FALSE	Turku	1662
Kungliga	Svenonius, Enevald (1617-1688)	To voema echmalotismenon: seu potius, 	To voema echmalotismenon: seu potius, gymnasium capiendæ rationis humanæ; in quo, auxiliante deo o.m. nec non annuente venerando senatu: per exercitationes Academicas decem, quæ in XX. disputationes publicas sunt distributæ, sobrius philosophiæ in theologiâ usus, novâ inventione ac methodo, perspicuè demonstratur. Quibus, præter nonnullas alias, peculiaris accessit, circa exercitationem quintam, digressio de lingva latina; cum cura professionis eloquentiæ romanæ incubabat authori Enevaldo Svenonio, q. Gyldenhielmorum al. s.s. theol. doct. ejusdemq[ue] in Regiâ Acad. Aboënsi prof. publico; past. ecclesiæ Lundoensis: nec non h.t. universitatis rectori	FALSE	Turku	1662
Kungliga	Kempe, Axel (1623-1682)	Bibliotheca Academiæ Aboensis sive elenchus, 	Bibliotheca Academiæ Aboensis sive elenchus, quo non modo certus scriptorum & librorum cujusqæ; facultatis numerus ordine alphabetico continetur; sed etiam ex quo initio, quibus incrementis, quorumve liberalitate & munificentia Bibliotheca	FALSE	Turku	1663
Kungliga	Kyander, Andreas Georgii (1691-NA)	Een kårt och eenfaldigh predikan 	Een kårt och eenfaldigh predikan om alla trogna Gudz barns ewiga vthkårelse och nådewahl til then ewiga saligheeten	FALSE	Turku	1663
Kungliga	Terserus, Johannes Elai (1605-1678)	Förklaring öfwer catechismum, eller the 	Förklaring öfwer catechismum, eller the sex wår christlige läras hufwudstycken. Thet wyrdiga ministerio vthi Åboo stifft til ähra och tiänst förfärdigat, och til. en lijten nyåhrs gåfwo förährat aff Joanne Elai Tersero episcopo Aboënse	FALSE	Turku	1663
Kungliga	Enebergh, Salomon L (NA-1667)	Oratio commendationem latinæ linguæ exhibens	Oratio commendationem latinæ linguæ exhibens	FALSE	Turku	1663
Kungliga	Lagus, Gabriel Josephi (1709-NA)	Oratiuncula Neostadii descriptionem ... repræsentans	Oratiuncula Neostadii descriptionem ... repræsentans	FALSE	Turku	1663
Kungliga	Thuronius, Andreas (1632-1665)	Compendium metaphysicæ, juxta ductum & 	Compendium metaphysicæ, juxta ductum & akribeian clarissimorum in hoc genere philosophorum concinnatum, & tam disputando quam legendo studiosæ juventuti propositum, in regià academià Aboensi,	FALSE	Turku	1664
Kungliga	Leander, Gabriel Erici (1691-NA)	Declamatio succincta paroeciæ Lethala (quæ 	Declamatio succincta paroeciæ Lethala (quæ comitatui Wazaborgh subjacet) encomia	FALSE	Turku	1664
Kungliga	Arnerus, Laurentius Olavi (1600-NA)	Encomium celeberrimæ urbis Norcopiæ: quod 	Encomium celeberrimæ urbis Norcopiæ: quod aspirante trinuno numine in frequentiâ admodum ... virorum ... præsentiâ, in Regia Aboënsi Academiâ, publicè, in auditorio majori, d. V. Octobris anni M DC LXII. proclamabat Laurentius Arnerus Norcopensis S. R. M. alumnus	FALSE	Turku	1664
Kungliga	Kexlerus, Simon Svenonis (1602-1669)	Gnomonicæ compendium	Gnomonicæ compendium	FALSE	Turku	1664
Kungliga	Reuter, Samuel (1679-NA)	Inauguratio templi S. S. Trinitatis	Inauguratio templi S. S. Trinitatis	FALSE	Turku	1664
Kungliga	Reuter, Samuel (1679-NA)	Inauguratio templi S.S.Trinitatis	Inauguratio templi S.S.Trinitatis	FALSE	Turku	1664
Kungliga	Miltopaeus, Martinus (1631-1679)	Institutiones oratoriæ; classicorum authorum, Ciceronis 	Institutiones oratoriæ; classicorum authorum, Ciceronis imprimis, Cæsaris, Livij, Sallustij, Taciti, Plinij utriusq[ue], Senecæ, Quintiliani, Velleji, Curtij, Iustini, & cæterorum, exemplis utilissimis ... locupletatæ: ac in usum studiosæ	FALSE	Turku	1664
Kungliga	NA	Kongl. May.tz Stadga och Påbudh, 	Kongl. May.tz Stadga och Påbudh, öfwer åthskillige Excessers och Oordningars affskaffande widh Rijkszens Presterskaps Trolofningar, Bröllop, Barndoop och Begrafningar, sampt Klädedrächter	FALSE	Turku	1664
Kungliga	NA	Kuningalisen maijestetin asetos eli kästy, 	Kuningalisen maijestetin asetos eli kästy, muutamitten sijwottomutte poispoistamisest waattein parsis, sekä adelin, että muiden säätyin personain tykönä täsä waldacunnasa	FALSE	Turku	1664
Kungliga	NA	Kuningalisen maijestetin asetos ja kästy, 	Kuningalisen maijestetin asetos ja kästy, Palckawäest ja Palcolisist	FALSE	Turku	1664
Kungliga	Drysenius, Magnus Laurentii (1636-1701)	Oratio de homine secundum tres 	Oratio de homine secundum tres status huius vitæ considerato	FALSE	Turku	1664
Kungliga	Torsk, Jonas Laurentii (1634-1691)	Oratio de pace	Oratio de pace	FALSE	Turku	1664
Kungliga	Brobergh, Gustavus Erici (1600-NA)	Oratiuncula complectens breviter Sudermanniæ descriptionem, 	Oratiuncula complectens breviter Sudermanniæ descriptionem, ejusq'; vera dignaq'; repræsentans encomia	FALSE	Turku	1664
Kungliga	Svenonius, Enevald (1617-1688)	Synopsis theologiæ, in quâ puritas 	Synopsis theologiæ, in quâ puritas christianæ religionis, sive lutheranæ ecclesiæ orthodoxia, e fontibus prophetarum & apostolorum hausta; .	FALSE	Turku	1664
Kungliga	Stephani, Laurentius (1600-NA)	Theanthropos thet är, Gudh och 	Theanthropos thet är, Gudh och menniskia författat vthi een kort och enfaldigh prestemötz predijkan, om Gudz sons Christi Jesu mandoms annammelse och hans tröstrijka tilkommelse vthi köttet, til menniskiones åtherlösning. hållen i Wijborgz domkyrckio, vthi thet prästemöthet som höltz den 17. 18. och 19. Januarij åhr 1663. Och nu cum consensu R.simi domini episcopi der sammastädes, vnder trycket gifwen, aff Laurentio Stephani, Careliâ Finnone .	FALSE	Turku	1664
Kungliga	Gezelius, Johannes (1615-1690)	Catechismi appendix, ad ven. clerum 	Catechismi appendix, ad ven. clerum directa.	FALSE	Turku	1666
Kungliga	Kexlerus, Simon Svenonis (1602-1669)	Cosmographiæ compendiosa descriptio & geographiæ 	Cosmographiæ compendiosa descriptio & geographiæ introductio de globi terreni & mapparum geograph. meliori intellectu ac usu, cum brevi orbis terreni adumbratione.	FALSE	Turku	1666
Kungliga	Brenner, Jacobus Henrici (1607-1684)	Gaudium christianum thet är: Christenheetenes 	Gaudium christianum thet är: Christenheetenes allmenne jwle-frögd öfwer wårs Herres och Frelsares Jesu Christi frögde- och nåderijke födelse ...	FALSE	Turku	1666
Kungliga	NA	Kong: [!] Mayest:tz Placat och 	Kong: [!] Mayest:tz Placat och Påbudh, Angående Mynte-Plåtarne	FALSE	Turku	1666
Kungliga	NA	Kongl. May.tz Placat och Stadga, 	Kongl. May.tz Placat och Stadga, Om Eder och Sabbatzbrott	FALSE	Turku	1666
Kungliga	NA	Kongl: Mayst:tz Placat, Angående Interesserne	Kongl: Mayst:tz Placat, Angående Interesserne	FALSE	Turku	1666
