catalog	author	short_title	title	dissertation	publication_place	publication_year
Kungliga	Carstenius, Petrus (NA-1710)	Oratio introductoria ad gymnasii Wiiburgensis 	Oratio introductoria ad gymnasii Wiiburgensis rectoratum de ejusdem gymnasii anno qvinqvagesimo sive jubileo	FALSE	Vyborg	1690
Kungliga	Bång, Petrus (1633-1696)	Christeligh liik-predikan, tå ... herren, 	Christeligh liik-predikan, tå ... herren, herr Berndt Melliin ... uti Wijborgz domkyrckia ... blef begrafwen den 26. januarij anno 1691 hållen af Petro Bång .	FALSE	Vyborg	1691
Kungliga	NA	Contract Som uppå Kongl. May:tz 	Contract Som uppå Kongl. May:tz Nådigste Willia och Befalning Allmogen i Wiborgz och Kymmene-Gårdz Lähn ingått Åhr 1696. Angående det wisza Knechtehållet	FALSE	Vyborg	1696
Kungliga	NA	Kongl. May:tz Reglemente Och Förordning, 	Kongl. May:tz Reglemente Och Förordning, Angående Knechtehållet i Wiborgz Lähn, affattadt Carlbärg den 15. Junii A. 1697	FALSE	Vyborg	1697
Kungliga	Lund, David (1657-1729)	Sampliga vyrdiga presterskapet i thet 	Sampliga vyrdiga presterskapet i thet lofl Viborgs stifft, önskas af Herranom nåde, frijd och hälso	FALSE	Vyborg	1711
Kungliga	NA	En riksgälds-sedels biographie. Svenskt original. 	En riksgälds-sedels biographie. Svenskt original. Wiborg, 1816. Tryckt hos Anders Cederwaller	FALSE	Vyborg	1816
Kungliga	Judén, Jacob (1781-1855)	Anteckningar af tankar uti warianta 	Anteckningar af tankar uti warianta ämnen af Jac. Judén. Wiborg, hos And. Cederwaller år 1827	FALSE	Vyborg	1827
Kungliga	Tegnér, Esaias (1782-1846)	Frithiofs saga af Esaias Tegnér. 	Frithiofs saga af Esaias Tegnér. Wiborg, tryckt hos A. Cederwaller, 1827	FALSE	Vyborg	1827
